[
  {
    "id": "1148685143",
    "title": "Baptism of Deacon Stulce (12/21/2025)",
    "duration": 54,
    "url": "https://player.vimeo.com/video/1148685143",
    "date": "2025-12-22T15:57:10+00:00"
  },
  {
    "id": "1148680365",
    "title": "Baptism of Emberlynn Burchard (12/21/25)",
    "duration": 26,
    "url": "https://player.vimeo.com/video/1148680365",
    "date": "2025-12-22T15:39:27+00:00"
  },
  {
    "id": "1148678273",
    "title": "Baptism of Gabriel Burchard (12/21/2025)",
    "duration": 45,
    "url": "https://player.vimeo.com/video/1148678273",
    "date": "2025-12-22T15:31:40+00:00"
  },
  {
    "id": "1148671428",
    "title": "From Promise to Presence: The Savior's Birth (12/21/2025)",
    "duration": 2442,
    "url": "https://player.vimeo.com/video/1148671428",
    "date": "2025-12-22T15:08:17+00:00"
  },
  {
    "id": "1146688174",
    "title": "Baptism of Cash Mains (12/14/2025)",
    "duration": 96,
    "url": "https://player.vimeo.com/video/1146688174",
    "date": "2025-12-15T19:16:09+00:00"
  },
  {
    "id": "1146629701",
    "title": "Baptism of Riot Williams (12/14/2025)",
    "duration": 58,
    "url": "https://player.vimeo.com/video/1146629701",
    "date": "2025-12-15T16:26:26+00:00"
  },
  {
    "id": "1146623589",
    "title": "From Promise to Presence: The Cousin's Birth (12/14/2025)",
    "duration": 2611,
    "url": "https://player.vimeo.com/video/1146623589",
    "date": "2025-12-15T16:08:16+00:00"
  },
  {
    "id": "1146622159",
    "title": "Baptism of Ellie Watson (12/14/2025)",
    "duration": 90,
    "url": "https://player.vimeo.com/video/1146622159",
    "date": "2025-12-15T16:04:13+00:00"
  },
  {
    "id": "1146617643",
    "title": "Baptism of Claire Tutt (12/14/2025)",
    "duration": 99,
    "url": "https://player.vimeo.com/video/1146617643",
    "date": "2025-12-15T15:50:51+00:00"
  },
  {
    "id": "1146616062",
    "title": "Baptism of Morgan Tutt (12/14/2025)",
    "duration": 102,
    "url": "https://player.vimeo.com/video/1146616062",
    "date": "2025-12-15T15:45:38+00:00"
  },
  {
    "id": "1144535464",
    "title": "Baptism of Josiah Griffieon (11/7/2025)",
    "duration": 122,
    "url": "https://player.vimeo.com/video/1144535464",
    "date": "2025-12-08T15:30:46+00:00"
  },
  {
    "id": "1144516365",
    "title": "From Promise to Presence: The Mother's Song (12/7/2025)",
    "duration": 2378,
    "url": "https://player.vimeo.com/video/1144516365",
    "date": "2025-12-08T14:29:33+00:00"
  },
  {
    "id": "1143286734",
    "title": "Systematic Theology class 13 - 12/3/25",
    "duration": 5872,
    "url": "https://player.vimeo.com/video/1143286734",
    "date": "2025-12-04T01:35:50+00:00"
  },
  {
    "id": "1142099001",
    "title": "Host an International Video",
    "duration": 174,
    "url": "https://player.vimeo.com/video/1142099001",
    "date": "2025-12-01T15:15:23+00:00"
  },
  {
    "id": "1142090830",
    "title": "From Promise to Presence: The Births' Foretelling (11/30/2025)",
    "duration": 2640,
    "url": "https://player.vimeo.com/video/1142090830",
    "date": "2025-12-01T14:52:30+00:00"
  },
  {
    "id": "1141844547",
    "title": "It's Christmas! Northpoint Kids",
    "duration": 192,
    "url": "https://player.vimeo.com/video/1141844547",
    "date": "2025-11-30T17:34:42+00:00"
  },
  {
    "id": "1141843040",
    "title": "Glorious Night",
    "duration": 217,
    "url": "https://player.vimeo.com/video/1141843040",
    "date": "2025-11-30T17:26:25+00:00"
  },
  {
    "id": "1140134789",
    "title": "The Promised King: Repents Again (11/23/2025)",
    "duration": 2470,
    "url": "https://player.vimeo.com/video/1140134789",
    "date": "2025-11-24T18:05:30+00:00"
  },
  {
    "id": "1140064976",
    "title": "God You're So Good",
    "duration": 250,
    "url": "https://player.vimeo.com/video/1140064976",
    "date": "2025-11-24T14:51:26+00:00"
  },
  {
    "id": "1139120450",
    "title": "From Promise to Presence",
    "duration": 39,
    "url": "https://player.vimeo.com/video/1139120450",
    "date": "2025-11-20T23:52:11+00:00"
  },
  {
    "id": "1138748297",
    "title": "Systematic Theology class 12 - 11/19/25",
    "duration": 4617,
    "url": "https://player.vimeo.com/video/1138748297",
    "date": "2025-11-20T01:37:52+00:00"
  },
  {
    "id": "1138705073",
    "title": "From Promise to Presence",
    "duration": 39,
    "url": "https://player.vimeo.com/video/1138705073",
    "date": "2025-11-19T22:43:20+00:00"
  },
  {
    "id": "1137730326",
    "title": "The Promised King: Praises (11/16/2025)",
    "duration": 2659,
    "url": "https://player.vimeo.com/video/1137730326",
    "date": "2025-11-17T15:48:49+00:00"
  },
  {
    "id": "1137718218",
    "title": "Baptism of Claire Loveridge (11/16/2026)",
    "duration": 109,
    "url": "https://player.vimeo.com/video/1137718218",
    "date": "2025-11-17T15:21:11+00:00"
  },
  {
    "id": "1137716902",
    "title": "The baptism of Elliot Greenlaw (11/16/2025)",
    "duration": 118,
    "url": "https://player.vimeo.com/video/1137716902",
    "date": "2025-11-17T15:17:46+00:00"
  },
  {
    "id": "1136319767",
    "title": "Systematic Theology class 11 - 11/12/25",
    "duration": 4530,
    "url": "https://player.vimeo.com/video/1136319767",
    "date": "2025-11-13T01:34:50+00:00"
  },
  {
    "id": "1135430029",
    "title": "The Promised King: Confesses (11/9/2025)",
    "duration": 1724,
    "url": "https://player.vimeo.com/video/1135430029",
    "date": "2025-11-10T17:28:16+00:00"
  },
  {
    "id": "1134065220",
    "title": "Systematic Theology class 10 - 11/5/25",
    "duration": 4701,
    "url": "https://player.vimeo.com/video/1134065220",
    "date": "2025-11-06T01:33:53+00:00"
  },
  {
    "id": "1133168402",
    "title": "The Promised King: Grieves (11/2/2025)",
    "duration": 2074,
    "url": "https://player.vimeo.com/video/1133168402",
    "date": "2025-11-03T15:48:38+00:00"
  },
  {
    "id": "1133162015",
    "title": "The Baptism of Gabriel Jeter (11/2/2025)",
    "duration": 173,
    "url": "https://player.vimeo.com/video/1133162015",
    "date": "2025-11-03T15:29:26+00:00"
  },
  {
    "id": "1131909623",
    "title": "Systematic Theology class 9 - 10/29/25",
    "duration": 4840,
    "url": "https://player.vimeo.com/video/1131909623",
    "date": "2025-10-30T00:39:07+00:00"
  },
  {
    "id": "1131713920",
    "title": "Burchard's Story: God Had a Plan",
    "duration": 198,
    "url": "https://player.vimeo.com/video/1131713920",
    "date": "2025-10-29T14:38:28+00:00"
  },
  {
    "id": "1130931247",
    "title": "The Promised King: Trusts (10/26/2025)",
    "duration": 2384,
    "url": "https://player.vimeo.com/video/1130931247",
    "date": "2025-10-27T14:38:50+00:00"
  },
  {
    "id": "1130926269",
    "title": "Baptism of Cai Munson (10/26/2025)",
    "duration": 42,
    "url": "https://player.vimeo.com/video/1130926269",
    "date": "2025-10-27T14:26:06+00:00"
  },
  {
    "id": "1130925787",
    "title": "Baptism of Emory Munson (10/26/2025)",
    "duration": 35,
    "url": "https://player.vimeo.com/video/1130925787",
    "date": "2025-10-27T14:24:50+00:00"
  },
  {
    "id": "1130924184",
    "title": "Baptism of MacKenenzie Foshee (10/26/2025)",
    "duration": 54,
    "url": "https://player.vimeo.com/video/1130924184",
    "date": "2025-10-27T14:20:47+00:00"
  },
  {
    "id": "1129715862",
    "title": "Systematic Theology Class 8 - 10/22/25",
    "duration": 4694,
    "url": "https://player.vimeo.com/video/1129715862",
    "date": "2025-10-23T00:27:05+00:00"
  },
  {
    "id": "1128874226",
    "title": "The Promised King: Rediscovers (10/19/2025)",
    "duration": 2339,
    "url": "https://player.vimeo.com/video/1128874226",
    "date": "2025-10-20T14:23:58+00:00"
  },
  {
    "id": "1127221670",
    "title": "Baptism of Cliff Dolton (10/12/2025)",
    "duration": 147,
    "url": "https://player.vimeo.com/video/1127221670",
    "date": "2025-10-14T15:32:24+00:00"
  },
  {
    "id": "1127219219",
    "title": "Baptism of Landon Couch (10/12/2025)",
    "duration": 38,
    "url": "https://player.vimeo.com/video/1127219219",
    "date": "2025-10-14T15:25:19+00:00"
  },
  {
    "id": "1127212584",
    "title": "Baptism of Landrie Smith (10/12/2025)",
    "duration": 48,
    "url": "https://player.vimeo.com/video/1127212584",
    "date": "2025-10-14T15:05:47+00:00"
  },
  {
    "id": "1127209257",
    "title": "Baptism of Melissa Carleton (10/12/2025)",
    "duration": 134,
    "url": "https://player.vimeo.com/video/1127209257",
    "date": "2025-10-14T14:56:40+00:00"
  },
  {
    "id": "1127205874",
    "title": "The Promised King: Struggles (10/12/2025)",
    "duration": 2416,
    "url": "https://player.vimeo.com/video/1127205874",
    "date": "2025-10-14T14:46:47+00:00"
  },
  {
    "id": "1127204915",
    "title": "Baptism of Rylan Baker (10/12/2025)",
    "duration": 61,
    "url": "https://player.vimeo.com/video/1127204915",
    "date": "2025-10-14T14:44:14+00:00"
  },
  {
    "id": "1125620054",
    "title": "Wales",
    "duration": 262,
    "url": "https://player.vimeo.com/video/1125620054",
    "date": "2025-10-08T17:53:57+00:00"
  },
  {
    "id": "1125286969",
    "title": "Systematic Theology Class 7 - 10/1/25",
    "duration": 4738,
    "url": "https://player.vimeo.com/video/1125286969",
    "date": "2025-10-07T18:50:30+00:00"
  },
  {
    "id": "1125277216",
    "title": "Systematic Theology Class 6 - 9/24/25",
    "duration": 4345,
    "url": "https://player.vimeo.com/video/1125277216",
    "date": "2025-10-07T18:19:10+00:00"
  },
  {
    "id": "1124844969",
    "title": "The Promised King: Repents (10/5/2025)",
    "duration": 2880,
    "url": "https://player.vimeo.com/video/1124844969",
    "date": "2025-10-06T13:49:00+00:00"
  },
  {
    "id": "1122872955",
    "title": "Baptism of Parker Robertson (9/28/2025)",
    "duration": 61,
    "url": "https://player.vimeo.com/video/1122872955",
    "date": "2025-09-29T14:19:05+00:00"
  },
  {
    "id": "1122868363",
    "title": "The Promised King: Conquers and Blesses (9/28/2025)",
    "duration": 2237,
    "url": "https://player.vimeo.com/video/1122868363",
    "date": "2025-09-29T14:07:10+00:00"
  },
  {
    "id": "1120851097",
    "title": "The Promised King: Fulfills (9/21/2025)",
    "duration": 2426,
    "url": "https://player.vimeo.com/video/1120851097",
    "date": "2025-09-22T14:21:43+00:00"
  },
  {
    "id": "1118762930",
    "title": "The Promised King: Waits & Worships (09/14/2025)",
    "duration": 2608,
    "url": "https://player.vimeo.com/video/1118762930",
    "date": "2025-09-15T14:30:24+00:00"
  },
  {
    "id": "1117910542",
    "title": "Systematic Theology Class 4 - 9/10/25",
    "duration": 3411,
    "url": "https://player.vimeo.com/video/1117910542",
    "date": "2025-09-11T19:44:59+00:00"
  },
  {
    "id": "1117893156",
    "title": "Who is Like Our God",
    "duration": 197,
    "url": "https://player.vimeo.com/video/1117893156",
    "date": "2025-09-11T18:47:26+00:00"
  },
  {
    "id": "1117893141",
    "title": "Praise Pt. 2",
    "duration": 76,
    "url": "https://player.vimeo.com/video/1117893141",
    "date": "2025-09-11T18:47:21+00:00"
  },
  {
    "id": "1117893113",
    "title": "Praise Pt. 1",
    "duration": 120,
    "url": "https://player.vimeo.com/video/1117893113",
    "date": "2025-09-11T18:47:14+00:00"
  },
  {
    "id": "1117154051",
    "title": "The Joy",
    "duration": 226,
    "url": "https://player.vimeo.com/video/1117154051",
    "date": "2025-09-09T15:47:23+00:00"
  },
  {
    "id": "1117154032",
    "title": "Act Justly, Love Mercy, Walk Humbly",
    "duration": 121,
    "url": "https://player.vimeo.com/video/1117154032",
    "date": "2025-09-09T15:47:18+00:00"
  },
  {
    "id": "1116889077",
    "title": "The Promised King: Reigns (9/7/2025)",
    "duration": 2413,
    "url": "https://player.vimeo.com/video/1116889077",
    "date": "2025-09-08T19:40:39+00:00"
  },
  {
    "id": "1116861727",
    "title": "The Promised King: Reign (9/7/2025)",
    "duration": 25191,
    "url": "https://player.vimeo.com/video/1116861727",
    "date": "2025-09-08T18:02:06+00:00"
  },
  {
    "id": "1115230946",
    "title": "Baptism of Joseph (8/31/2025)",
    "duration": 288,
    "url": "https://player.vimeo.com/video/1115230946",
    "date": "2025-09-02T16:49:05+00:00"
  },
  {
    "id": "1115181921",
    "title": "Previously On...He Shall Reign (8/31/2025)",
    "duration": 2163,
    "url": "https://player.vimeo.com/video/1115181921",
    "date": "2025-09-02T14:18:46+00:00"
  },
  {
    "id": "1115179929",
    "title": "Baptism of Annie Madole (8/31/2025)",
    "duration": 128,
    "url": "https://player.vimeo.com/video/1115179929",
    "date": "2025-09-02T14:12:54+00:00"
  },
  {
    "id": "1114048758",
    "title": "Systematic Theology Class 2 - Part 2 - 8/27/25",
    "duration": 134,
    "url": "https://player.vimeo.com/video/1114048758",
    "date": "2025-08-28T20:36:53+00:00"
  },
  {
    "id": "1114029231",
    "title": "Systematic Theology Class 2 - Part 1 - 8/27/25",
    "duration": 2150,
    "url": "https://player.vimeo.com/video/1114029231",
    "date": "2025-08-28T19:28:43+00:00"
  },
  {
    "id": "1113008138",
    "title": "For God So Loved",
    "duration": 262,
    "url": "https://player.vimeo.com/video/1113008138",
    "date": "2025-08-25T19:38:41+00:00"
  },
  {
    "id": "1112982474",
    "title": "Family Discipleship Service (8/24/2025)",
    "duration": 2998,
    "url": "https://player.vimeo.com/video/1112982474",
    "date": "2025-08-25T18:08:49+00:00"
  },
  {
    "id": "1112918436",
    "title": "Awakening to the Supremacy of Christ (8/24/2025)",
    "duration": 2237,
    "url": "https://player.vimeo.com/video/1112918436",
    "date": "2025-08-25T14:53:15+00:00"
  },
  {
    "id": "1112904101",
    "title": "Baptism of Kinsey Foshee (8/24/2025)",
    "duration": 112,
    "url": "https://player.vimeo.com/video/1112904101",
    "date": "2025-08-25T14:06:02+00:00"
  },
  {
    "id": "1112107071",
    "title": "The Baptism of Dennis Daniel (8/17/2025)",
    "duration": 118,
    "url": "https://player.vimeo.com/video/1112107071",
    "date": "2025-08-21T20:46:00+00:00"
  },
  {
    "id": "1112095736",
    "title": "Systematic Theology Class 1 - 8/20/25",
    "duration": 4987,
    "url": "https://player.vimeo.com/video/1112095736",
    "date": "2025-08-21T20:00:34+00:00"
  },
  {
    "id": "1111695690",
    "title": "Trust in God pt. 3",
    "duration": 76,
    "url": "https://player.vimeo.com/video/1111695690",
    "date": "2025-08-20T15:18:10+00:00"
  },
  {
    "id": "1111695671",
    "title": "Trust in God pt. 2",
    "duration": 119,
    "url": "https://player.vimeo.com/video/1111695671",
    "date": "2025-08-20T15:18:08+00:00"
  },
  {
    "id": "1111695631",
    "title": "Trust in God pt. 1",
    "duration": 120,
    "url": "https://player.vimeo.com/video/1111695631",
    "date": "2025-08-20T15:18:02+00:00"
  },
  {
    "id": "1111678699",
    "title": "Happy Day",
    "duration": 185,
    "url": "https://player.vimeo.com/video/1111678699",
    "date": "2025-08-20T14:27:17+00:00"
  },
  {
    "id": "1111024503",
    "title": "What He's Done! (8/17/25)",
    "duration": 1917,
    "url": "https://player.vimeo.com/video/1111024503",
    "date": "2025-08-18T16:48:34+00:00"
  },
  {
    "id": "1109071810",
    "title": "Realigned: Christlike (8/10/25)",
    "duration": 2413,
    "url": "https://player.vimeo.com/video/1109071810",
    "date": "2025-08-11T14:33:37+00:00"
  },
  {
    "id": "1107116641",
    "title": "Baptism of Bridgette Fudge (8/3/2025)",
    "duration": 80,
    "url": "https://player.vimeo.com/video/1107116641",
    "date": "2025-08-04T14:57:02+00:00"
  },
  {
    "id": "1107115528",
    "title": "Baptism of Gage Randell (8/3/2025)",
    "duration": 54,
    "url": "https://player.vimeo.com/video/1107115528",
    "date": "2025-08-04T14:53:49+00:00"
  },
  {
    "id": "1107108925",
    "title": "Realigned: Loving Your Enemies (8/3/2025)",
    "duration": 2490,
    "url": "https://player.vimeo.com/video/1107108925",
    "date": "2025-08-04T14:32:57+00:00"
  },
  {
    "id": "1107086127",
    "title": "Kids Kamp 2025",
    "duration": 108,
    "url": "https://player.vimeo.com/video/1107086127",
    "date": "2025-08-04T13:20:12+00:00"
  },
  {
    "id": "1106137266",
    "title": "Kids Kamp 2025 Day 3",
    "duration": 289,
    "url": "https://player.vimeo.com/video/1106137266",
    "date": "2025-07-31T14:01:34+00:00"
  },
  {
    "id": "1105791481",
    "title": "Kids Kamp 2025 Day 2",
    "duration": 249,
    "url": "https://player.vimeo.com/video/1105791481",
    "date": "2025-07-30T13:40:19+00:00"
  },
  {
    "id": "1105466561",
    "title": "Kids Kamp 2025 Day 1",
    "duration": 145,
    "url": "https://player.vimeo.com/video/1105466561",
    "date": "2025-07-29T13:58:39+00:00"
  },
  {
    "id": "1105191608",
    "title": "Baptism of Henslee Tilley (7/27/2025)",
    "duration": 112,
    "url": "https://player.vimeo.com/video/1105191608",
    "date": "2025-07-28T16:35:54+00:00"
  },
  {
    "id": "1105137219",
    "title": "Realigned: Humble (7/27/25)",
    "duration": 2442,
    "url": "https://player.vimeo.com/video/1105137219",
    "date": "2025-07-28T13:49:12+00:00"
  },
  {
    "id": "1103146003",
    "title": "Realigned: Peacemaker (7/20/2025)",
    "duration": 2435,
    "url": "https://player.vimeo.com/video/1103146003",
    "date": "2025-07-21T14:10:59+00:00"
  },
  {
    "id": "1101224690",
    "title": "Realigned: Hospitable (7/13/2025)",
    "duration": 2377,
    "url": "https://player.vimeo.com/video/1101224690",
    "date": "2025-07-14T14:09:10+00:00"
  },
  {
    "id": "1101211520",
    "title": "Student Camp 2025",
    "duration": 107,
    "url": "https://player.vimeo.com/video/1101211520",
    "date": "2025-07-14T13:26:27+00:00"
  },
  {
    "id": "1099360439",
    "title": "Realigned: Generous (7/6/2025)",
    "duration": 2496,
    "url": "https://player.vimeo.com/video/1099360439",
    "date": "2025-07-07T13:56:05+00:00"
  },
  {
    "id": "1097534846",
    "title": "Realigned: Prayerful (6/29/2025)",
    "duration": 867,
    "url": "https://player.vimeo.com/video/1097534846",
    "date": "2025-06-30T13:58:19+00:00"
  },
  {
    "id": "1095623782",
    "title": "Realigned: Patient (6/22/2025)",
    "duration": 2806,
    "url": "https://player.vimeo.com/video/1095623782",
    "date": "2025-06-23T14:27:18+00:00"
  },
  {
    "id": "1093742755",
    "title": "Realigned: Joyful (6/15/2025)",
    "duration": 2499,
    "url": "https://player.vimeo.com/video/1093742755",
    "date": "2025-06-16T14:57:45+00:00"
  },
  {
    "id": "1091897887",
    "title": "Realigned: Zealous (6/8/2025)",
    "duration": 2224,
    "url": "https://player.vimeo.com/video/1091897887",
    "date": "2025-06-09T18:57:34+00:00"
  },
  {
    "id": "1089777950",
    "title": "Realigned: Honoring (6/1/2025)",
    "duration": 2646,
    "url": "https://player.vimeo.com/video/1089777950",
    "date": "2025-06-02T16:19:06+00:00"
  },
  {
    "id": "1087756502",
    "title": "Realigned: Caring (5/25/2025)",
    "duration": 2537,
    "url": "https://player.vimeo.com/video/1087756502",
    "date": "2025-05-26T14:48:09+00:00"
  },
  {
    "id": "1085474402",
    "title": "Realigned: Holy (5/18/2025)",
    "duration": 2639,
    "url": "https://player.vimeo.com/video/1085474402",
    "date": "2025-05-18T16:59:01+00:00"
  },
  {
    "id": "1083595231",
    "title": "Realigned: Genuine Love (5/11/2025)",
    "duration": 2608,
    "url": "https://player.vimeo.com/video/1083595231",
    "date": "2025-05-12T16:34:42+00:00"
  },
  {
    "id": "1081281278",
    "title": "ReAligned: Serving (5/4/2025)",
    "duration": 2134,
    "url": "https://player.vimeo.com/video/1081281278",
    "date": "2025-05-04T16:12:43+00:00"
  },
  {
    "id": "1080309858",
    "title": "Joyful Sound (4/29/2025)",
    "duration": 4422,
    "url": "https://player.vimeo.com/video/1080309858",
    "date": "2025-04-30T18:42:34+00:00"
  },
  {
    "id": "1079134223",
    "title": "ReAligned: New Life (4/27/2025)",
    "duration": 2061,
    "url": "https://player.vimeo.com/video/1079134223",
    "date": "2025-04-27T16:09:28+00:00"
  },
  {
    "id": "1077095758",
    "title": "Resurrection Day: Death to Life (4/20/2025)",
    "duration": 1709,
    "url": "https://player.vimeo.com/video/1077095758",
    "date": "2025-04-20T16:25:11+00:00"
  },
  {
    "id": "1075107349",
    "title": "Palm Sunday: Hosanna to the Son of David (4/13/2025)",
    "duration": 2247,
    "url": "https://player.vimeo.com/video/1075107349",
    "date": "2025-04-13T17:43:45+00:00"
  },
  {
    "id": "1072985030",
    "title": "He Shall Reign: The Final Battle (4/6/2025)",
    "duration": 2335,
    "url": "https://player.vimeo.com/video/1072985030",
    "date": "2025-04-06T16:57:21+00:00"
  },
  {
    "id": "1071035030",
    "title": "He Shall Reign: The Lost Saul (3/30/2025)",
    "duration": 2770,
    "url": "https://player.vimeo.com/video/1071035030",
    "date": "2025-03-31T13:20:42+00:00"
  },
  {
    "id": "1068858582",
    "title": "He Shall Reign: The Prodigal David (3/23/25)",
    "duration": 2569,
    "url": "https://player.vimeo.com/video/1068858582",
    "date": "2025-03-24T14:22:39+00:00"
  },
  {
    "id": "1066340138",
    "title": "He Shall Reign: Where Are You? (3/16/2025)",
    "duration": 2338,
    "url": "https://player.vimeo.com/video/1066340138",
    "date": "2025-03-16T16:20:16+00:00"
  },
  {
    "id": "1064167139",
    "title": "He Shall Reign: Wisdom Triumphs (3/9/2025)",
    "duration": 2290,
    "url": "https://player.vimeo.com/video/1064167139",
    "date": "2025-03-10T04:34:06+00:00"
  },
  {
    "id": "1061787878",
    "title": "He Shall Reign: Vengeance Is Mine (3/2/2025)",
    "duration": 2445,
    "url": "https://player.vimeo.com/video/1061787878",
    "date": "2025-03-02T16:59:13+00:00"
  },
  {
    "id": "1059482168",
    "title": "He Shall Reign: Providence & Deliverance (2/23/2025)",
    "duration": 2251,
    "url": "https://player.vimeo.com/video/1059482168",
    "date": "2025-02-23T17:08:00+00:00"
  },
  {
    "id": "1057888210",
    "title": "He Shall Reign: Inquire of the Lord (2/16/2025)",
    "duration": 2431,
    "url": "https://player.vimeo.com/video/1057888210",
    "date": "2025-02-18T15:24:34+00:00"
  },
  {
    "id": "1054980837",
    "title": "He Shall Reign: Turmoil & Tragedy (2/9/2025)",
    "duration": 2157,
    "url": "https://player.vimeo.com/video/1054980837",
    "date": "2025-02-09T16:51:24+00:00"
  },
  {
    "id": "1053084950",
    "title": "He Shall Reign: Training Camp (2/2/2025)",
    "duration": 2296,
    "url": "https://player.vimeo.com/video/1053084950",
    "date": "2025-02-03T16:31:09+00:00"
  },
  {
    "id": "1050527415",
    "title": "He Shall Reign: The Cost of Faithfulness (1/26/2025)",
    "duration": 2216,
    "url": "https://player.vimeo.com/video/1050527415",
    "date": "2025-01-26T17:09:37+00:00"
  },
  {
    "id": "1048335232",
    "title": "He Shall Reign: In the Shadow of the Almighty (1/19/2025)",
    "duration": 2325,
    "url": "https://player.vimeo.com/video/1048335232",
    "date": "2025-01-19T17:07:00+00:00"
  },
  {
    "id": "1046172865",
    "title": "He Shall Reign: The Difference Maker (1/12/2025)",
    "duration": 2468,
    "url": "https://player.vimeo.com/video/1046172865",
    "date": "2025-01-12T16:28:26+00:00"
  },
  {
    "id": "1044183273",
    "title": "He Shall Reign: The Battle Is the Lord's (1/5/2025)",
    "duration": 2741,
    "url": "https://player.vimeo.com/video/1044183273",
    "date": "2025-01-06T01:39:00+00:00"
  },
  {
    "id": "1043444502",
    "title": "The Psalms: Which Way Are You Headed? - Psalm 78 (12/29/2024)",
    "duration": 2750,
    "url": "https://player.vimeo.com/video/1043444502",
    "date": "2025-01-02T15:18:49+00:00"
  },
  {
    "id": "1041534233",
    "title": "God With Us: Grace and Truth (12/22/2024)",
    "duration": 2480,
    "url": "https://player.vimeo.com/video/1041534233",
    "date": "2024-12-22T16:23:28+00:00"
  },
  {
    "id": "1039426461",
    "title": "God With Us: Light (12/15/2024)",
    "duration": 2563,
    "url": "https://player.vimeo.com/video/1039426461",
    "date": "2024-12-15T17:04:00+00:00"
  },
  {
    "id": "1037218887",
    "title": "God With Us: Life (12/8/2024)",
    "duration": 2353,
    "url": "https://player.vimeo.com/video/1037218887",
    "date": "2024-12-08T17:10:20+00:00"
  },
  {
    "id": "1034961869",
    "title": "The Psalms: Restless Faith - Psalm 77 (12/01/2024)",
    "duration": 2640,
    "url": "https://player.vimeo.com/video/1034961869",
    "date": "2024-12-01T16:19:05+00:00"
  },
  {
    "id": "1033123348",
    "title": "He Shall Reign: God's Presence Is Primary (11/24/2024)",
    "duration": 2534,
    "url": "https://player.vimeo.com/video/1033123348",
    "date": "2024-11-25T15:35:51+00:00"
  },
  {
    "id": "1030496094",
    "title": "He Shall Reign: Obedience Matters (11/17/24)",
    "duration": 2558,
    "url": "https://player.vimeo.com/video/1030496094",
    "date": "2024-11-17T16:26:04+00:00"
  },
  {
    "id": "1028912367",
    "title": "He Shall Reign: 7 Lessons from Ancient Teachers (11/10/2024)",
    "duration": 2661,
    "url": "https://player.vimeo.com/video/1028912367",
    "date": "2024-11-12T16:42:36+00:00"
  },
  {
    "id": "1028892808",
    "title": "He Shall Reign: 7 Lessons from Saul & Jonathan",
    "duration": 2661,
    "url": "https://player.vimeo.com/video/1028892808",
    "date": "2024-11-12T15:52:24+00:00"
  },
  {
    "id": "1025883773",
    "title": "He Shall Reign: Mighty to Save (11/3/2024)",
    "duration": 2302,
    "url": "https://player.vimeo.com/video/1025883773",
    "date": "2024-11-03T16:22:20+00:00"
  },
  {
    "id": "1023722806",
    "title": "He Shall Reign: Trust and Obey (10/27/24)",
    "duration": 2387,
    "url": "https://player.vimeo.com/video/1023722806",
    "date": "2024-10-27T16:13:01+00:00"
  },
  {
    "id": "1021757438",
    "title": "The Psalms: Fear the Lord - Psalm 76 (10/20/24)",
    "duration": 2163,
    "url": "https://player.vimeo.com/video/1021757438",
    "date": "2024-10-21T14:33:04+00:00"
  },
  {
    "id": "1019161689",
    "title": "He Shall Reign: Return to Me (10/13/24)",
    "duration": 2230,
    "url": "https://player.vimeo.com/video/1019161689",
    "date": "2024-10-13T15:27:31+00:00"
  },
  {
    "id": "1016762778",
    "title": "He Shall Reign: The Humble Savior (10/06/24)",
    "duration": 2281,
    "url": "https://player.vimeo.com/video/1016762778",
    "date": "2024-10-06T15:21:35+00:00"
  },
  {
    "id": "1015014654",
    "title": "Dan Testimony",
    "duration": 854,
    "url": "https://player.vimeo.com/video/1015014654",
    "date": "2024-10-01T22:28:39+00:00"
  },
  {
    "id": "1014446328",
    "title": "Chris Cross Testimony",
    "duration": 2860,
    "url": "https://player.vimeo.com/video/1014446328",
    "date": "2024-09-30T16:49:43+00:00"
  },
  {
    "id": "1014044239",
    "title": "He Shall Reign: Lost Donkeys and a Found King (9/29/24)",
    "duration": 2078,
    "url": "https://player.vimeo.com/video/1014044239",
    "date": "2024-09-29T15:23:05+00:00"
  },
  {
    "id": "1013168835",
    "title": "Trebor Nall Testimony",
    "duration": 1128,
    "url": "https://player.vimeo.com/video/1013168835",
    "date": "2024-09-26T13:58:39+00:00"
  },
  {
    "id": "1011779562",
    "title": "He Shall Reign: Who Shall Reign? (09/22/24)",
    "duration": 2042,
    "url": "https://player.vimeo.com/video/1011779562",
    "date": "2024-09-22T15:33:15+00:00"
  },
  {
    "id": "1009894759",
    "title": "He Shall Reign: The Weight of Glory (9/15/2024)",
    "duration": 2105,
    "url": "https://player.vimeo.com/video/1009894759",
    "date": "2024-09-16T14:49:40+00:00"
  },
  {
    "id": "1007707987",
    "title": "He Shall Reign: A Faithful Priest, and a Faithful Prophet (9/8/2024)",
    "duration": 2078,
    "url": "https://player.vimeo.com/video/1007707987",
    "date": "2024-09-09T15:11:32+00:00"
  },
  {
    "id": "1005140195",
    "title": "He Shall Reign: The Heartbeat of God (9/01/2024)",
    "duration": 2099,
    "url": "https://player.vimeo.com/video/1005140195",
    "date": "2024-09-01T15:44:10+00:00"
  },
  {
    "id": "1002431490",
    "title": "He Shall Reign: True Worship (8/25/2024)",
    "duration": 2174,
    "url": "https://player.vimeo.com/video/1002431490",
    "date": "2024-08-25T15:46:48+00:00"
  },
  {
    "id": "1000109408",
    "title": "He Shall Reign: The Fulfillment of Our Desires (8/18/2024)",
    "duration": 2288,
    "url": "https://player.vimeo.com/video/1000109408",
    "date": "2024-08-18T17:27:05+00:00"
  },
  {
    "id": "997466590",
    "title": "He Shall Reign: An Introduction to 1 Samuel (8/11/2024)",
    "duration": 2091,
    "url": "https://player.vimeo.com/video/997466590",
    "date": "2024-08-11T18:57:25+00:00"
  },
  {
    "id": "994811605",
    "title": "The Psalms: A Song of Justice - Psalm 75 (8/4/2024)",
    "duration": 2115,
    "url": "https://player.vimeo.com/video/994811605",
    "date": "2024-08-04T18:00:23+00:00"
  },
  {
    "id": "991195255",
    "title": "The Psalms: Certain Faith In Uncertain Times - Psalm 74 (7/28/2024)",
    "duration": 2501,
    "url": "https://player.vimeo.com/video/991195255",
    "date": "2024-07-28T15:44:44+00:00"
  },
  {
    "id": "988021078",
    "title": "The Psalms: A Crisis of Faith - Psalm 73 (7/21/2024)",
    "duration": 2507,
    "url": "https://player.vimeo.com/video/988021078",
    "date": "2024-07-21T15:48:01+00:00"
  },
  {
    "id": "983908846",
    "title": "The Psalms: The Ideal King - Psalm 72 (7/14/2024)",
    "duration": 2197,
    "url": "https://player.vimeo.com/video/983908846",
    "date": "2024-07-14T16:52:12+00:00"
  },
  {
    "id": "979979992",
    "title": "The Psalms: Start, Stay and Finish Strong! - Psalm 71 (7/7/2024)",
    "duration": 1750,
    "url": "https://player.vimeo.com/video/979979992",
    "date": "2024-07-07T15:44:03+00:00"
  },
  {
    "id": "972324531",
    "title": "The Psalms: O God, Do Not Delay! - Psalm 70 (6/30/2024)",
    "duration": 2379,
    "url": "https://player.vimeo.com/video/972324531",
    "date": "2024-06-30T16:13:02+00:00"
  },
  {
    "id": "965984011",
    "title": "The Psalms: The Suffering Servant - Psalm 69 (6/23/2024)",
    "duration": 2467,
    "url": "https://player.vimeo.com/video/965984011",
    "date": "2024-06-23T16:17:56+00:00"
  },
  {
    "id": "959647099",
    "title": "The Psalms: God's Triumph - Psalm 68 (6/16/2024)",
    "duration": 2494,
    "url": "https://player.vimeo.com/video/959647099",
    "date": "2024-06-16T16:06:30+00:00"
  },
  {
    "id": "955526589",
    "title": "The Psalms: Let The Nations Be Glad - Psalm 67 (6/9/2024)",
    "duration": 2342,
    "url": "https://player.vimeo.com/video/955526589",
    "date": "2024-06-09T15:44:12+00:00"
  },
  {
    "id": "952866413",
    "title": "The Psalms: Shout! Sing! Say! - Psalm 66 (6/2/2024)",
    "duration": 1857,
    "url": "https://player.vimeo.com/video/952866413",
    "date": "2024-06-02T15:43:55+00:00"
  },
  {
    "id": "950520163",
    "title": "The Psalms: Praise the Savior and Sustainer - Psalm 65 (5/26/2024)",
    "duration": 2054,
    "url": "https://player.vimeo.com/video/950520163",
    "date": "2024-05-26T15:48:44+00:00"
  },
  {
    "id": "948452724",
    "title": "Faithful: In Life (5/19/2024)",
    "duration": 2218,
    "url": "https://player.vimeo.com/video/948452724",
    "date": "2024-05-20T19:53:57+00:00"
  },
  {
    "id": "945531452",
    "title": "Faithful: In Victory (5/12/2024)",
    "duration": 1946,
    "url": "https://player.vimeo.com/video/945531452",
    "date": "2024-05-12T16:38:03+00:00"
  },
  {
    "id": "942997043",
    "title": "Faithful: In Leadership (5/5/2024)",
    "duration": 2229,
    "url": "https://player.vimeo.com/video/942997043",
    "date": "2024-05-05T16:57:57+00:00"
  },
  {
    "id": "940872430",
    "title": "Faithful: 60th Anniversary (4/28/2024)",
    "duration": 783,
    "url": "https://player.vimeo.com/video/940872430",
    "date": "2024-04-29T15:44:35+00:00"
  },
  {
    "id": "937393015",
    "title": "Faithful: In Temptation (4/21/2024)",
    "duration": 1876,
    "url": "https://player.vimeo.com/video/937393015",
    "date": "2024-04-21T15:37:13+00:00"
  },
  {
    "id": "934521109",
    "title": "Faithful: In Sustaining (4/14/2024)",
    "duration": 2253,
    "url": "https://player.vimeo.com/video/934521109",
    "date": "2024-04-14T15:54:49+00:00"
  },
  {
    "id": "931779622",
    "title": "Faithful: In Power (4/7/2024)",
    "duration": 2322,
    "url": "https://player.vimeo.com/video/931779622",
    "date": "2024-04-07T17:16:53+00:00"
  },
  {
    "id": "929306277",
    "title": "Easter: He Is Risen! He Is Risen Indeed! (3/31/2024)",
    "duration": 2017,
    "url": "https://player.vimeo.com/video/929306277",
    "date": "2024-03-31T16:19:15+00:00"
  },
  {
    "id": "926851602",
    "title": "Palm Sunday: The Misunderstood Entry (3/24/2024)",
    "duration": 2236,
    "url": "https://player.vimeo.com/video/926851602",
    "date": "2024-03-24T16:17:02+00:00"
  },
  {
    "id": "924368694",
    "title": "The Psalms: From Fear to Faith - Psalm 64 (3/17/2024)",
    "duration": 2205,
    "url": "https://player.vimeo.com/video/924368694",
    "date": "2024-03-17T16:39:03+00:00"
  },
  {
    "id": "923389559",
    "title": "Digging Deeper - Christian Liberty",
    "duration": 3872,
    "url": "https://player.vimeo.com/video/923389559",
    "date": "2024-03-14T15:24:57+00:00"
  },
  {
    "id": "922086773",
    "title": "Called 2 Love - Week 6",
    "duration": 4178,
    "url": "https://player.vimeo.com/video/922086773",
    "date": "2024-03-11T16:04:15+00:00"
  },
  {
    "id": "921764728",
    "title": "First Things First: Christian Liberty (3/10/2024)",
    "duration": 2468,
    "url": "https://player.vimeo.com/video/921764728",
    "date": "2024-03-10T17:38:23+00:00"
  },
  {
    "id": "920547567",
    "title": "Digging Deeper - Reformed Theology",
    "duration": 3965,
    "url": "https://player.vimeo.com/video/920547567",
    "date": "2024-03-07T17:10:33+00:00"
  },
  {
    "id": "919669343",
    "title": "Digging Deeper - Ecclesiology",
    "duration": 4116,
    "url": "https://player.vimeo.com/video/919669343",
    "date": "2024-03-05T16:30:11+00:00"
  },
  {
    "id": "919369424",
    "title": "Called 2 Love - Week 5",
    "duration": 4178,
    "url": "https://player.vimeo.com/video/919369424",
    "date": "2024-03-04T23:54:44+00:00"
  },
  {
    "id": "919365290",
    "title": "Called 2 Love - Week 4",
    "duration": 4577,
    "url": "https://player.vimeo.com/video/919365290",
    "date": "2024-03-04T23:37:37+00:00"
  },
  {
    "id": "918939483",
    "title": "First Things First: Reformed Theology (3/3/2024)",
    "duration": 2528,
    "url": "https://player.vimeo.com/video/918939483",
    "date": "2024-03-03T21:16:29+00:00"
  },
  {
    "id": "916483338",
    "title": "First Things First: Ecclesiology (2/25/2024)",
    "duration": 2547,
    "url": "https://player.vimeo.com/video/916483338",
    "date": "2024-02-25T18:43:32+00:00"
  },
  {
    "id": "915649510",
    "title": "Digging Deeper - Last Things",
    "duration": 3940,
    "url": "https://player.vimeo.com/video/915649510",
    "date": "2024-02-22T17:16:37+00:00"
  },
  {
    "id": "915343420",
    "title": "Called 2 Love - Week 3",
    "duration": 2898,
    "url": "https://player.vimeo.com/video/915343420",
    "date": "2024-02-21T21:38:50+00:00"
  },
  {
    "id": "914213239",
    "title": "First Things First: Last Things (2/18/2024)",
    "duration": 2393,
    "url": "https://player.vimeo.com/video/914213239",
    "date": "2024-02-18T19:36:42+00:00"
  },
  {
    "id": "913382745",
    "title": "Digging Deeper - Salvation",
    "duration": 3890,
    "url": "https://player.vimeo.com/video/913382745",
    "date": "2024-02-15T16:43:54+00:00"
  },
  {
    "id": "913345725",
    "title": "Digging Deeper - Humanity",
    "duration": 3724,
    "url": "https://player.vimeo.com/video/913345725",
    "date": "2024-02-15T15:07:02+00:00"
  },
  {
    "id": "912369502",
    "title": "Called 2 Love - Week 2",
    "duration": 4671,
    "url": "https://player.vimeo.com/video/912369502",
    "date": "2024-02-12T20:40:37+00:00"
  },
  {
    "id": "912046530",
    "title": "First Things First: Salvation (2/11/2024)",
    "duration": 2064,
    "url": "https://player.vimeo.com/video/912046530",
    "date": "2024-02-11T18:27:23+00:00"
  },
  {
    "id": "910946285",
    "title": "Called 2 Love - Week 1",
    "duration": 4778,
    "url": "https://player.vimeo.com/video/910946285",
    "date": "2024-02-07T19:55:40+00:00"
  },
  {
    "id": "909817455",
    "title": "First Things First: Humanity (2/4/2024)",
    "duration": 2260,
    "url": "https://player.vimeo.com/video/909817455",
    "date": "2024-02-04T20:15:24+00:00"
  },
  {
    "id": "908762085",
    "title": "Digging Deeper - God the Son",
    "duration": 3821,
    "url": "https://player.vimeo.com/video/908762085",
    "date": "2024-02-01T18:10:17+00:00"
  },
  {
    "id": "907214775",
    "title": "First Things First: God [Part 3- God the Son] (1/28/2024)",
    "duration": 2409,
    "url": "https://player.vimeo.com/video/907214775",
    "date": "2024-01-28T16:50:05+00:00"
  },
  {
    "id": "906437599",
    "title": "Digging Deeper - Trinity",
    "duration": 3974,
    "url": "https://player.vimeo.com/video/906437599",
    "date": "2024-01-25T17:00:01+00:00"
  },
  {
    "id": "904956272",
    "title": "First Things First: God [Part 2- Trinity] (1/21/2024)",
    "duration": 2366,
    "url": "https://player.vimeo.com/video/904956272",
    "date": "2024-01-21T17:43:12+00:00"
  },
  {
    "id": "904161804",
    "title": "Digging Deeper - God's Attributes",
    "duration": 3796,
    "url": "https://player.vimeo.com/video/904161804",
    "date": "2024-01-18T17:29:32+00:00"
  },
  {
    "id": "902766995",
    "title": "First Things First: God [Part 1 - Attributes] (1/14/2024)",
    "duration": 2465,
    "url": "https://player.vimeo.com/video/902766995",
    "date": "2024-01-14T20:11:03+00:00"
  },
  {
    "id": "901728361",
    "title": "Digging Deeper - Revelation",
    "duration": 4053,
    "url": "https://player.vimeo.com/video/901728361",
    "date": "2024-01-11T02:22:59+00:00"
  },
  {
    "id": "900607003",
    "title": "First Things First: Revelation (1/7/2024)",
    "duration": 2330,
    "url": "https://player.vimeo.com/video/900607003",
    "date": "2024-01-07T20:37:19+00:00"
  },
  {
    "id": "898948431",
    "title": "Week of Prayer (12/31/2023)",
    "duration": 1446,
    "url": "https://player.vimeo.com/video/898948431",
    "date": "2023-12-31T21:24:52+00:00"
  },
  {
    "id": "897657116",
    "title": "Good News of Great Joy: Angels (12/24/2023)",
    "duration": 886,
    "url": "https://player.vimeo.com/video/897657116",
    "date": "2023-12-25T00:51:01+00:00"
  },
  {
    "id": "895614152",
    "title": "Good News of Great Joy: Simeon (12/17/2023)",
    "duration": 2310,
    "url": "https://player.vimeo.com/video/895614152",
    "date": "2023-12-17T20:30:17+00:00"
  },
  {
    "id": "893100487",
    "title": "Good News of Great Joy: Zechariah (12/10/2023)",
    "duration": 2494,
    "url": "https://player.vimeo.com/video/893100487",
    "date": "2023-12-10T19:09:24+00:00"
  },
  {
    "id": "890866703",
    "title": "Good News of Great Joy: Mary (12/03/2023)",
    "duration": 2513,
    "url": "https://player.vimeo.com/video/890866703",
    "date": "2023-12-03T21:45:45+00:00"
  },
  {
    "id": "888750286",
    "title": "The Psalms: My Soul Thirsts for You - Psalm 63 (11/26/2023)",
    "duration": 1964,
    "url": "https://player.vimeo.com/video/888750286",
    "date": "2023-11-27T16:11:30+00:00"
  },
  {
    "id": "886203695",
    "title": "Christ Above All: The Body of Christ (11/19/2023)",
    "duration": 2300,
    "url": "https://player.vimeo.com/video/886203695",
    "date": "2023-11-19T20:45:53+00:00"
  },
  {
    "id": "883749507",
    "title": "Christ Above All: The Mission of God (11/12/2023)",
    "duration": 2127,
    "url": "https://player.vimeo.com/video/883749507",
    "date": "2023-11-12T17:34:57+00:00"
  },
  {
    "id": "883599629",
    "title": "Gary_Henley_Memorial_1080",
    "duration": 7208,
    "url": "https://player.vimeo.com/video/883599629",
    "date": "2023-11-11T19:45:16+00:00"
  },
  {
    "id": "881429406",
    "title": "Christ Above All: New-Creation Relationships (11/05/2023)",
    "duration": 2319,
    "url": "https://player.vimeo.com/video/881429406",
    "date": "2023-11-05T17:04:26+00:00"
  },
  {
    "id": "879150356",
    "title": "Christ Above All: Put On the New Self (10/29/2023)",
    "duration": 2350,
    "url": "https://player.vimeo.com/video/879150356",
    "date": "2023-10-29T15:35:06+00:00"
  },
  {
    "id": "876948106",
    "title": "Christ Above All: Put Off the Old Self (10/22/2023)",
    "duration": 2504,
    "url": "https://player.vimeo.com/video/876948106",
    "date": "2023-10-22T23:51:02+00:00"
  },
  {
    "id": "874555303",
    "title": "25 Years in Nicaragua (10/15/2023)",
    "duration": 2410,
    "url": "https://player.vimeo.com/video/874555303",
    "date": "2023-10-15T17:03:40+00:00"
  },
  {
    "id": "872327522",
    "title": "Christ Above All: A New Identity (10/08/2023)",
    "duration": 2471,
    "url": "https://player.vimeo.com/video/872327522",
    "date": "2023-10-08T16:58:33+00:00"
  },
  {
    "id": "871202747",
    "title": "CG Certification - Administrative Coordinator",
    "duration": 965,
    "url": "https://player.vimeo.com/video/871202747",
    "date": "2023-10-04T19:50:18+00:00"
  },
  {
    "id": "870070182",
    "title": "Christ Above All: The Fulfillment of the Law (10/01/2023)",
    "duration": 2630,
    "url": "https://player.vimeo.com/video/870070182",
    "date": "2023-10-01T17:45:37+00:00"
  },
  {
    "id": "868941936",
    "title": "CG Certification- Mission Coordinator",
    "duration": 878,
    "url": "https://player.vimeo.com/video/868941936",
    "date": "2023-09-27T23:15:48+00:00"
  },
  {
    "id": "867690130",
    "title": "Christ Above All: Walking in Christ (9/24/2023)",
    "duration": 2563,
    "url": "https://player.vimeo.com/video/867690130",
    "date": "2023-09-24T17:07:44+00:00"
  },
  {
    "id": "866410983",
    "title": "CG Certification - Outreach/Social Coordinator",
    "duration": 703,
    "url": "https://player.vimeo.com/video/866410983",
    "date": "2023-09-20T15:13:57+00:00"
  },
  {
    "id": "865316488",
    "title": "Christ Above All- The Ministry of God (9/17/2023)",
    "duration": 2596,
    "url": "https://player.vimeo.com/video/865316488",
    "date": "2023-09-17T16:20:29+00:00"
  },
  {
    "id": "864144843",
    "title": "CG Certification - Prayer/Care Coordinator",
    "duration": 1249,
    "url": "https://player.vimeo.com/video/864144843",
    "date": "2023-09-13T19:43:31+00:00"
  },
  {
    "id": "862934795",
    "title": "Christ Above All: The Supremacy of Christ (9/10/2023)",
    "duration": 2434,
    "url": "https://player.vimeo.com/video/862934795",
    "date": "2023-09-10T18:36:07+00:00"
  },
  {
    "id": "861811472",
    "title": "CG Certification - Director",
    "duration": 975,
    "url": "https://player.vimeo.com/video/861811472",
    "date": "2023-09-06T21:32:10+00:00"
  },
  {
    "id": "861810010",
    "title": "CG Certification - Bible Teacher",
    "duration": 1120,
    "url": "https://player.vimeo.com/video/861810010",
    "date": "2023-09-06T21:25:51+00:00"
  },
  {
    "id": "860665142",
    "title": "The Psalms: Trusting in a Trustworthy God - Psalm 62 (9/3/2023)",
    "duration": 1764,
    "url": "https://player.vimeo.com/video/860665142",
    "date": "2023-09-03T16:50:15+00:00"
  },
  {
    "id": "858405168",
    "title": "Christ Above All: Prayer (8/27/2023)",
    "duration": 2250,
    "url": "https://player.vimeo.com/video/858405168",
    "date": "2023-08-27T16:28:42+00:00"
  },
  {
    "id": "857283437",
    "title": "CG Certification - Vision Casting",
    "duration": 713,
    "url": "https://player.vimeo.com/video/857283437",
    "date": "2023-08-23T20:15:59+00:00"
  },
  {
    "id": "856223343",
    "title": "Christ Above All: Thanksgiving (8-20-2023)",
    "duration": 2341,
    "url": "https://player.vimeo.com/video/856223343",
    "date": "2023-08-20T19:22:49+00:00"
  },
  {
    "id": "854159531",
    "title": "Christ Above All: Introduction (8/13/2023)",
    "duration": 2414,
    "url": "https://player.vimeo.com/video/854159531",
    "date": "2023-08-13T17:30:11+00:00"
  },
  {
    "id": "852134744",
    "title": "Serve Sunday: Serving (8/6/2023)",
    "duration": 2443,
    "url": "https://player.vimeo.com/video/852134744",
    "date": "2023-08-06T17:44:08+00:00"
  },
  {
    "id": "849922056",
    "title": "Resting In Jesus: Jesus Is Our Rest (7/30/2023)",
    "duration": 2542,
    "url": "https://player.vimeo.com/video/849922056",
    "date": "2023-07-30T16:10:40+00:00"
  },
  {
    "id": "847804918",
    "title": "Love Jesus | Live Sent: Our Mission (7/23/2023)",
    "duration": 2540,
    "url": "https://player.vimeo.com/video/847804918",
    "date": "2023-07-23T20:53:15+00:00"
  },
  {
    "id": "845778931",
    "title": "The Psalms: Far Away From Home - Psalm 61 (7/16/2023)",
    "duration": 2206,
    "url": "https://player.vimeo.com/video/845778931",
    "date": "2023-07-17T01:07:59+00:00"
  },
  {
    "id": "843689996",
    "title": "The Psalms: Nissi - Psalm 60 (7-9-2023)",
    "duration": 2870,
    "url": "https://player.vimeo.com/video/843689996",
    "date": "2023-07-09T19:45:51+00:00"
  },
  {
    "id": "841657675",
    "title": "The Psalms: Bad Guys - Good God - Psalms 59 (7/02/2023)",
    "duration": 1791,
    "url": "https://player.vimeo.com/video/841657675",
    "date": "2023-07-02T17:00:34+00:00"
  },
  {
    "id": "839489477",
    "title": "The Psalms: Imminent Justice - Psalms 58 (6/25/2023)",
    "duration": 1767,
    "url": "https://player.vimeo.com/video/839489477",
    "date": "2023-06-25T17:03:06+00:00"
  },
  {
    "id": "838746293",
    "title": "061123 Weekend Review",
    "duration": 1112,
    "url": "https://player.vimeo.com/video/838746293",
    "date": "2023-06-22T16:57:13+00:00"
  },
  {
    "id": "837349343",
    "title": "The Psalms: Faithful Refuge - Psalms 57 (6/18/2023)",
    "duration": 2120,
    "url": "https://player.vimeo.com/video/837349343",
    "date": "2023-06-18T16:49:11+00:00"
  },
  {
    "id": "835202793",
    "title": "The Psalms: From Danger to Deliverance - Psalms 56 (6/11/2023)",
    "duration": 1841,
    "url": "https://player.vimeo.com/video/835202793",
    "date": "2023-06-11T16:29:14+00:00"
  },
  {
    "id": "833089229",
    "title": "The Psalms: Deliver Me from Distraction - Psalms 55 (6/04/2023)",
    "duration": 1574,
    "url": "https://player.vimeo.com/video/833089229",
    "date": "2023-06-04T17:33:58+00:00"
  },
  {
    "id": "831010033",
    "title": "Who is the Holy Spirit: Pentacost - Acts 2:1-13 (5/28/2023)",
    "duration": 2117,
    "url": "https://player.vimeo.com/video/831010033",
    "date": "2023-05-28T17:12:02+00:00"
  },
  {
    "id": "828798538",
    "title": "The Judge is Coming: Joel 3:1-16 (5/21/2023)",
    "duration": 2460,
    "url": "https://player.vimeo.com/video/828798538",
    "date": "2023-05-21T17:09:19+00:00"
  },
  {
    "id": "826672558",
    "title": "Knowing God: Joel 3:17-21 (5/14/2023)",
    "duration": 2808,
    "url": "https://player.vimeo.com/video/826672558",
    "date": "2023-05-14T17:01:21+00:00"
  },
  {
    "id": "824535702",
    "title": "A Call that Saves: Joel 2:28-32 (5/07/2023)",
    "duration": 2210,
    "url": "https://player.vimeo.com/video/824535702",
    "date": "2023-05-07T16:16:19+00:00"
  },
  {
    "id": "822534295",
    "title": "Dark Stars, Deep Cries and Divine Grace: Joel 2:1-27 (4/30/2023)",
    "duration": 3143,
    "url": "https://player.vimeo.com/video/822534295",
    "date": "2023-04-30T20:00:19+00:00"
  },
  {
    "id": "820289308",
    "title": "Lessons from Locusts: Joel 1:1-20 (4/23/2023)",
    "duration": 2458,
    "url": "https://player.vimeo.com/video/820289308",
    "date": "2023-04-23T16:54:48+00:00"
  },
  {
    "id": "818140695",
    "title": "The Importance of Christ's Ascension - Acts 1:1-11(4/16/2023)",
    "duration": 2334,
    "url": "https://player.vimeo.com/video/818140695",
    "date": "2023-04-16T17:38:33+00:00"
  },
  {
    "id": "816043450",
    "title": "That You May Believe: The Gospel According to John - John 18-21 (4/09/2023)",
    "duration": 2315,
    "url": "https://player.vimeo.com/video/816043450",
    "date": "2023-04-09T18:03:40+00:00"
  },
  {
    "id": "814017163",
    "title": "That You May Believe: The Gospel According to Mark - Mark 14-16 (4-02-2023)",
    "duration": 2426,
    "url": "https://player.vimeo.com/video/814017163",
    "date": "2023-04-02T16:41:10+00:00"
  },
  {
    "id": "812075319",
    "title": "That You May Believe: The Gospel According to Matthew - Matthew 27:62â€“28:15 (3-26-2023)",
    "duration": 2287,
    "url": "https://player.vimeo.com/video/812075319",
    "date": "2023-03-27T15:10:03+00:00"
  },
  {
    "id": "809517604",
    "title": "The Psalms: Desperate and Dependent - Psalms 54 (3/19/2023)",
    "duration": 2318,
    "url": "https://player.vimeo.com/video/809517604",
    "date": "2023-03-19T16:37:22+00:00"
  },
  {
    "id": "807261876",
    "title": "The Psalms: The Shame of the Fool - Psalms 53 (3/12/2023)",
    "duration": 2330,
    "url": "https://player.vimeo.com/video/807261876",
    "date": "2023-03-12T16:19:15+00:00"
  },
  {
    "id": "806421770",
    "title": "Culture Wars: Climate Change (3-08-2023)",
    "duration": 4151,
    "url": "https://player.vimeo.com/video/806421770",
    "date": "2023-03-09T16:51:38+00:00"
  },
  {
    "id": "804887022",
    "title": "His Very Own: Closing Thoughts - Titus 3:12-15 (03-05-2023)",
    "duration": 2117,
    "url": "https://player.vimeo.com/video/804887022",
    "date": "2023-03-05T17:47:27+00:00"
  },
  {
    "id": "804859858",
    "title": "Culture Wars: Religious Liberty (3-01-2023)",
    "duration": 4107,
    "url": "https://player.vimeo.com/video/804859858",
    "date": "2023-03-05T15:37:39+00:00"
  },
  {
    "id": "802480107",
    "title": "His Very Own: Discipline - Titus 3:9-11 (2-26-2023)",
    "duration": 2398,
    "url": "https://player.vimeo.com/video/802480107",
    "date": "2023-02-26T19:50:44+00:00"
  },
  {
    "id": "801608480",
    "title": "Culture Wars: Racism (2-22-23)",
    "duration": 4631,
    "url": "https://player.vimeo.com/video/801608480",
    "date": "2023-02-23T14:30:41+00:00"
  },
  {
    "id": "800682538",
    "title": "His Very Own: Good Works - Titus 3:1-8 (2-19-2023)",
    "duration": 2741,
    "url": "https://player.vimeo.com/video/800682538",
    "date": "2023-02-20T23:00:51+00:00"
  },
  {
    "id": "799517011",
    "title": "Culture Wars: LGBTQ+ (2-15-2023)",
    "duration": 4868,
    "url": "https://player.vimeo.com/video/799517011",
    "date": "2023-02-16T15:32:26+00:00"
  },
  {
    "id": "799284770",
    "title": "Our Story in Light of God's Story (2-8-2023)",
    "duration": 4982,
    "url": "https://player.vimeo.com/video/799284770",
    "date": "2023-02-15T22:10:11+00:00"
  },
  {
    "id": "798566714",
    "title": "His Very Own: Purity - Titus 2:11-15 (2-12-23)",
    "duration": 2978,
    "url": "https://player.vimeo.com/video/798566714",
    "date": "2023-02-13T23:21:54+00:00"
  },
  {
    "id": "796101057",
    "title": "His Very Own: Discipling Women - Titus 2:1-10 (2-5-2023)",
    "duration": 2364,
    "url": "https://player.vimeo.com/video/796101057",
    "date": "2023-02-05T21:49:54+00:00"
  },
  {
    "id": "795342323",
    "title": "Our Story in Light of God's Story: Redemption Promised & Pictured - The Story of Israel (2-1-2023)",
    "duration": 4043,
    "url": "https://player.vimeo.com/video/795342323",
    "date": "2023-02-02T18:57:42+00:00"
  },
  {
    "id": "793897800",
    "title": "His Very Own: Discipling Men - Titus 2:1-10 (1-29-2023)",
    "duration": 2525,
    "url": "https://player.vimeo.com/video/793897800",
    "date": "2023-01-29T19:39:33+00:00"
  },
  {
    "id": "791670363",
    "title": "His Very Own: Truth - Titus 1:10-16 (1-22-2023)",
    "duration": 2198,
    "url": "https://player.vimeo.com/video/791670363",
    "date": "2023-01-22T19:00:53+00:00"
  },
  {
    "id": "791665682",
    "title": "Our Story in Light of God's Story: Creation & Fall (1-18-2023)",
    "duration": 4028,
    "url": "https://player.vimeo.com/video/791665682",
    "date": "2023-01-22T18:37:16+00:00"
  },
  {
    "id": "789508385",
    "title": "Night of Worship (1-11-2023)",
    "duration": 3350,
    "url": "https://player.vimeo.com/video/789508385",
    "date": "2023-01-15T19:47:09+00:00"
  },
  {
    "id": "789490761",
    "title": "His Very Own: Elders - Titus 1:5-9 (1-15-2023)",
    "duration": 2728,
    "url": "https://player.vimeo.com/video/789490761",
    "date": "2023-01-15T18:09:04+00:00"
  },
  {
    "id": "787364903",
    "title": "His Very Own: Gospel Introductions - Titus 1:1-4 (1-8-2023)",
    "duration": 2466,
    "url": "https://player.vimeo.com/video/787364903",
    "date": "2023-01-08T18:42:27+00:00"
  },
  {
    "id": "785603218",
    "title": "A Week of Prayer: Solemn Assembly - Joel 2:12-17 (1-1-2023)",
    "duration": 3589,
    "url": "https://player.vimeo.com/video/785603218",
    "date": "2023-01-01T21:58:41+00:00"
  },
  {
    "id": "784427019",
    "title": "Christmas Eve Service (12-24-2022)",
    "duration": 3748,
    "url": "https://player.vimeo.com/video/784427019",
    "date": "2022-12-26T21:41:27+00:00"
  },
  {
    "id": "782316681",
    "title": "Advent: Love - 1 John 4:7-12 (12-18-2022)",
    "duration": 2719,
    "url": "https://player.vimeo.com/video/782316681",
    "date": "2022-12-18T20:01:40+00:00"
  },
  {
    "id": "780206152",
    "title": "Deacon Ordination (12-7-2022)",
    "duration": 3823,
    "url": "https://player.vimeo.com/video/780206152",
    "date": "2022-12-12T00:42:06+00:00"
  },
  {
    "id": "780148394",
    "title": "Advent: Joy - Luke 2:8-20 (12-11-2022)",
    "duration": 2420,
    "url": "https://player.vimeo.com/video/780148394",
    "date": "2022-12-11T18:39:06+00:00"
  },
  {
    "id": "777867367",
    "title": "Advent: Peace - Ephesians 2:11-22 (12-4-2022)",
    "duration": 2692,
    "url": "https://player.vimeo.com/video/777867367",
    "date": "2022-12-04T18:39:51+00:00"
  },
  {
    "id": "777102457",
    "title": "Advent: Hope - Matthew 12:15-21 (11-30-2022)",
    "duration": 1446,
    "url": "https://player.vimeo.com/video/777102457",
    "date": "2022-12-01T19:18:31+00:00"
  },
  {
    "id": "775537505",
    "title": "The Psalms: God's Faithfulness Endures Forever! - Psalm 52 (11-27-2022)",
    "duration": 1945,
    "url": "https://player.vimeo.com/video/775537505",
    "date": "2022-11-27T18:13:58+00:00"
  },
  {
    "id": "773089990",
    "title": "12. Disciple Making 101: How to Multiply Disciples: Multiply Your Life (11-16-2022)",
    "duration": 2544,
    "url": "https://player.vimeo.com/video/773089990",
    "date": "2022-11-20T20:07:16+00:00"
  },
  {
    "id": "773076572",
    "title": "Who Can Ascend: God is Salvation - Micah 7:18-20 (11-20-2022)",
    "duration": 2083,
    "url": "https://player.vimeo.com/video/773076572",
    "date": "2022-11-20T18:57:41+00:00"
  },
  {
    "id": "770504156",
    "title": "Who Can Ascend: Tell of God's Salvation - Micah 7:11-17 (11-13-2022)",
    "duration": 2573,
    "url": "https://player.vimeo.com/video/770504156",
    "date": "2022-11-13T21:03:26+00:00"
  },
  {
    "id": "770480832",
    "title": "11. Disciple Making 101: How to Multiply Disciples: The Holy Spirit's Role (11-9-2022)",
    "duration": 1470,
    "url": "https://player.vimeo.com/video/770480832",
    "date": "2022-11-13T19:12:39+00:00"
  },
  {
    "id": "767872416",
    "title": "10. Disciple Making 101: Make Time for What Matters Most (11-2-2022)",
    "duration": 1346,
    "url": "https://player.vimeo.com/video/767872416",
    "date": "2022-11-06T20:35:28+00:00"
  },
  {
    "id": "767843718",
    "title": "Who Can Ascend: Wait for God's Salvation - Micah 7:1-10 (11-6-2022)",
    "duration": 2257,
    "url": "https://player.vimeo.com/video/767843718",
    "date": "2022-11-06T18:08:39+00:00"
  },
  {
    "id": "765495693",
    "title": "9. Disciple Making 101: Launch a Group (10-26-2022)",
    "duration": 1080,
    "url": "https://player.vimeo.com/video/765495693",
    "date": "2022-10-30T20:17:17+00:00"
  },
  {
    "id": "765491084",
    "title": "Who Can Ascend: Explanation of Judgment - Micah 6:9-16 (10-30-2022)",
    "duration": 2460,
    "url": "https://player.vimeo.com/video/765491084",
    "date": "2022-10-30T19:50:03+00:00"
  },
  {
    "id": "763156628",
    "title": "8. Disciple Making 101: Cast the Vision (10-19-2022)",
    "duration": 1383,
    "url": "https://player.vimeo.com/video/763156628",
    "date": "2022-10-23T18:02:12+00:00"
  },
  {
    "id": "763146797",
    "title": "Who Can Ascend: God's Standard - Micah 6:1-8 (10-23-2022)",
    "duration": 2339,
    "url": "https://player.vimeo.com/video/763146797",
    "date": "2022-10-23T17:09:57+00:00"
  },
  {
    "id": "760824990",
    "title": "The Psalms: I've Sinned, Now What? - Psalm 51 (10-16-2022)",
    "duration": 2369,
    "url": "https://player.vimeo.com/video/760824990",
    "date": "2022-10-16T18:45:29+00:00"
  },
  {
    "id": "758499700",
    "title": "Who Can Ascend: A Holy Nation - Micah 5:5b-15 (10-9-2022)",
    "duration": 2384,
    "url": "https://player.vimeo.com/video/758499700",
    "date": "2022-10-09T18:16:34+00:00"
  },
  {
    "id": "758493382",
    "title": "7. Disciple Making 101: Choose Disciples Wisely (10-5-2022)",
    "duration": 1727,
    "url": "https://player.vimeo.com/video/758493382",
    "date": "2022-10-09T17:44:01+00:00"
  },
  {
    "id": "756169620",
    "title": "Who Can Ascend: The Deliverer - Micah 5:2-5a (10-2-2022)",
    "duration": 2458,
    "url": "https://player.vimeo.com/video/756169620",
    "date": "2022-10-02T18:00:23+00:00"
  },
  {
    "id": "756120080",
    "title": "6. Disciple Making 101: Make Disciples Like Jesus (9-28-2022)",
    "duration": 1382,
    "url": "https://player.vimeo.com/video/756120080",
    "date": "2022-10-02T13:43:11+00:00"
  },
  {
    "id": "753648170",
    "title": "Transformation Marriage Weekend: Session 3 - How Do We Reconnect? (9-24-2022)",
    "duration": 4252,
    "url": "https://player.vimeo.com/video/753648170",
    "date": "2022-09-25T23:15:05+00:00"
  },
  {
    "id": "753640575",
    "title": "Transformation Marriage Weekend: Session 2 - What Happened to Us? With Q&A (9-23-2022)",
    "duration": 4612,
    "url": "https://player.vimeo.com/video/753640575",
    "date": "2022-09-25T22:29:46+00:00"
  },
  {
    "id": "753637696",
    "title": "Transformation Marriage Weekend: Session 1 - Why Do We Get Married? (9-23-2022)",
    "duration": 3043,
    "url": "https://player.vimeo.com/video/753637696",
    "date": "2022-09-25T22:11:49+00:00"
  },
  {
    "id": "753635620",
    "title": "5. Disciple Making 101: How to Identify Disciples - Are They Deployed into the World (9-21-2022)",
    "duration": 1561,
    "url": "https://player.vimeo.com/video/753635620",
    "date": "2022-09-25T21:59:19+00:00"
  },
  {
    "id": "753586630",
    "title": "Who Can Ascend: A Delivered Nation - Micah 4:6-5:1 (9-25-2022)",
    "duration": 2386,
    "url": "https://player.vimeo.com/video/753586630",
    "date": "2022-09-25T17:35:43+00:00"
  },
  {
    "id": "750977449",
    "title": "Christian Parenting (9-14-2022)",
    "duration": 4371,
    "url": "https://player.vimeo.com/video/750977449",
    "date": "2022-09-18T18:56:09+00:00"
  },
  {
    "id": "750972108",
    "title": "Who Can Ascend: A Delivered City - Micah 4:1-5 (9-18-2022)",
    "duration": 2637,
    "url": "https://player.vimeo.com/video/750972108",
    "date": "2022-09-18T18:31:09+00:00"
  },
  {
    "id": "748555464",
    "title": "4. Disciple Making 101: How to Identify Disciples - Are they Developing in Character (9-7-2022)",
    "duration": 1588,
    "url": "https://player.vimeo.com/video/748555464",
    "date": "2022-09-11T19:26:15+00:00"
  },
  {
    "id": "748538850",
    "title": "Who Can Ascend: Judgment on Leaders - Micah 3:1-12 (9-11-2022)",
    "duration": 2868,
    "url": "https://player.vimeo.com/video/748538850",
    "date": "2022-09-11T17:54:39+00:00"
  },
  {
    "id": "747680367",
    "title": "MOJ Intake Video",
    "duration": 854,
    "url": "https://player.vimeo.com/video/747680367",
    "date": "2022-09-08T14:29:28+00:00"
  },
  {
    "id": "746338472",
    "title": "3. Disciple Making 101: How to Identify Disciples - Are they Devoted to Christ (8-31-2022)",
    "duration": 1408,
    "url": "https://player.vimeo.com/video/746338472",
    "date": "2022-09-04T18:40:24+00:00"
  },
  {
    "id": "746334774",
    "title": "The Psalms: Worship from the Heart - Psalm 50 (9-4-2022)",
    "duration": 2377,
    "url": "https://player.vimeo.com/video/746334774",
    "date": "2022-09-04T18:16:37+00:00"
  },
  {
    "id": "743963617",
    "title": "2. Disciple Making 101: The End Product (8-24-22)",
    "duration": 1217,
    "url": "https://player.vimeo.com/video/743963617",
    "date": "2022-08-28T18:25:34+00:00"
  },
  {
    "id": "743960347",
    "title": "Who Can Ascend: Judgement on Oppressors - Micah 2:1-13 (8-28-2022)",
    "duration": 2632,
    "url": "https://player.vimeo.com/video/743960347",
    "date": "2022-08-28T18:07:17+00:00"
  },
  {
    "id": "741653670",
    "title": "1. Disciple Making 101: The Goal (8-17-22)",
    "duration": 1929,
    "url": "https://player.vimeo.com/video/741653670",
    "date": "2022-08-21T18:55:51+00:00"
  },
  {
    "id": "741641400",
    "title": "Who Can Ascend: Judgement on Sin - Micah 1:2-16 (8-21-2022)",
    "duration": 2184,
    "url": "https://player.vimeo.com/video/741641400",
    "date": "2022-08-21T17:46:28+00:00"
  },
  {
    "id": "739436040",
    "title": "Who Can Ascend: Context & Overview - Micah 1:1 (8-14-2022)",
    "duration": 2645,
    "url": "https://player.vimeo.com/video/739436040",
    "date": "2022-08-14T17:47:27+00:00"
  },
  {
    "id": "737333270",
    "title": "Parables: The Talents - Luke 19:11-27 (8-7-2022)",
    "duration": 2404,
    "url": "https://player.vimeo.com/video/737333270",
    "date": "2022-08-07T17:37:25+00:00"
  },
  {
    "id": "735214540",
    "title": "Parables: The Pharisee & The Tax Collector - Luke 18:9-14 (7-31-2022)",
    "duration": 2194,
    "url": "https://player.vimeo.com/video/735214540",
    "date": "2022-07-31T17:42:37+00:00"
  },
  {
    "id": "733003403",
    "title": "Parables: The Lost Sheep, Coin, and Sons - Luke 15:1-32 (7-24-2022)",
    "duration": 2352,
    "url": "https://player.vimeo.com/video/733003403",
    "date": "2022-07-24T18:05:59+00:00"
  },
  {
    "id": "730789118",
    "title": "Parables: The Two Builders - Luke 6:46-49 (7-17-2022)",
    "duration": 2548,
    "url": "https://player.vimeo.com/video/730789118",
    "date": "2022-07-17T18:21:39+00:00"
  },
  {
    "id": "728607010",
    "title": "Parables: The Samaritan - Luke 10:25-37 (7-10-2022)",
    "duration": 2134,
    "url": "https://player.vimeo.com/video/728607010",
    "date": "2022-07-10T17:47:06+00:00"
  },
  {
    "id": "726510578",
    "title": "Parables: The Tower Builder & The Warring King - Luke 14:25-33 (7-3-2022)",
    "duration": 2563,
    "url": "https://player.vimeo.com/video/726510578",
    "date": "2022-07-03T17:52:32+00:00"
  },
  {
    "id": "724235990",
    "title": "Parables: The Wedding Feast - Luke 14:16-24 (6-26-2022)",
    "duration": 2552,
    "url": "https://player.vimeo.com/video/724235990",
    "date": "2022-06-26T17:50:00+00:00"
  },
  {
    "id": "721996378",
    "title": "Parables: The Rich Fool - Luke 12:13-21 (6-19-2022)",
    "duration": 2289,
    "url": "https://player.vimeo.com/video/721996378",
    "date": "2022-06-19T21:42:03+00:00"
  },
  {
    "id": "719619215",
    "title": "Parables: The Two Debtors - Luke 7:36-50 (6-12-2022)",
    "duration": 2429,
    "url": "https://player.vimeo.com/video/719619215",
    "date": "2022-06-12T18:24:24+00:00"
  },
  {
    "id": "717305947",
    "title": "Parables: The Sower - Luke 8:4-15 (6-5-2022)",
    "duration": 2383,
    "url": "https://player.vimeo.com/video/717305947",
    "date": "2022-06-05T18:59:18+00:00"
  },
  {
    "id": "714981056",
    "title": "The Psalms: Wealth vs. Death - Psalm 49 (5-29-2022)",
    "duration": 2389,
    "url": "https://player.vimeo.com/video/714981056",
    "date": "2022-05-29T17:31:55+00:00"
  },
  {
    "id": "712683122",
    "title": "Jesus: To Love Him is to...Give - 2 Corinthians 8:1-9:15 (5-22-2022)",
    "duration": 2567,
    "url": "https://player.vimeo.com/video/712683122",
    "date": "2022-05-23T01:05:27+00:00"
  },
  {
    "id": "711706455",
    "title": "How We Got the Bible: Equipping Night 7 - Dan Leiphart (5-18-2022)",
    "duration": 4526,
    "url": "https://player.vimeo.com/video/711706455",
    "date": "2022-05-19T15:36:53+00:00"
  },
  {
    "id": "710099473",
    "title": "Jesus: To Love Him is to...Serve - 1 Corinthians 12:12-27 (5-15-2022)",
    "duration": 2296,
    "url": "https://player.vimeo.com/video/710099473",
    "date": "2022-05-15T17:46:18+00:00"
  },
  {
    "id": "709224022",
    "title": "How We Got the Bible: Equipping Night 6 - Dan Leiphart (5-11-2022)",
    "duration": 4393,
    "url": "https://player.vimeo.com/video/709224022",
    "date": "2022-05-12T19:15:19+00:00"
  },
  {
    "id": "707545702",
    "title": "Jesus: To Love Him is to...Fast - Matthew 6:16-18 (5-8-2022)",
    "duration": 1966,
    "url": "https://player.vimeo.com/video/707545702",
    "date": "2022-05-08T17:38:26+00:00"
  },
  {
    "id": "705485351",
    "title": "Joyful Sound Choir Concert (4-28-2022)",
    "duration": 4433,
    "url": "https://player.vimeo.com/video/705485351",
    "date": "2022-05-02T19:10:49+00:00"
  },
  {
    "id": "705151037",
    "title": "Jesus: To Love Him is to...Pray - Matthew 6:5-15 (5-1-2022)",
    "duration": 2617,
    "url": "https://player.vimeo.com/video/705151037",
    "date": "2022-05-01T18:50:53+00:00"
  },
  {
    "id": "704243976",
    "title": "How We Got the Bible: Equipping Night 5 - Dan Leiphart (4-27-2022)",
    "duration": 4285,
    "url": "https://player.vimeo.com/video/704243976",
    "date": "2022-04-28T17:44:51+00:00"
  },
  {
    "id": "702594805",
    "title": "Jesus: To Love Him is to...Study - 2 Timothy 3:16-17 (4-24-2022)",
    "duration": 2530,
    "url": "https://player.vimeo.com/video/702594805",
    "date": "2022-04-24T17:34:43+00:00"
  },
  {
    "id": "701781932",
    "title": "How We Got the Bible: Equipping Night 4 - Dan Leiphart (4-20-2022)",
    "duration": 4034,
    "url": "https://player.vimeo.com/video/701781932",
    "date": "2022-04-21T19:02:41+00:00"
  },
  {
    "id": "700228022",
    "title": "Behold the Passion of Jesus: Sunday - Luke 24:1-49 (4-17-2022)",
    "duration": 2293,
    "url": "https://player.vimeo.com/video/700228022",
    "date": "2022-04-17T16:25:06+00:00"
  },
  {
    "id": "699527210",
    "title": "How We Got the Bible: Equipping Night 3 - Dan Leiphart (4-13-2022)",
    "duration": 4495,
    "url": "https://player.vimeo.com/video/699527210",
    "date": "2022-04-14T17:31:56+00:00"
  },
  {
    "id": "697937379",
    "title": "Behold the Passion of Jesus: Friday - Luke 23:26-56 (4-10-2022)",
    "duration": 2679,
    "url": "https://player.vimeo.com/video/697937379",
    "date": "2022-04-10T18:02:29+00:00"
  },
  {
    "id": "697093582",
    "title": "How We Got the Bible: Equipping Night 2 - Dan Leiphart (4-6-2022)",
    "duration": 4186,
    "url": "https://player.vimeo.com/video/697093582",
    "date": "2022-04-07T18:26:00+00:00"
  },
  {
    "id": "695456468",
    "title": "Behold the Passion of Jesus: Thursday Night - Luke 22:63-23:25 (4-3-2022)",
    "duration": 2474,
    "url": "https://player.vimeo.com/video/695456468",
    "date": "2022-04-03T18:12:22+00:00"
  },
  {
    "id": "694556238",
    "title": "How We Got the Bible: Equipping Night 1 - Dan Leiphart (3-30-2022)",
    "duration": 4383,
    "url": "https://player.vimeo.com/video/694556238",
    "date": "2022-03-31T18:33:39+00:00"
  },
  {
    "id": "692830854",
    "title": "Behold the Passion of Jesus: Thursday Evening - Luke 22:1-62 (3-27-2022)",
    "duration": 2380,
    "url": "https://player.vimeo.com/video/692830854",
    "date": "2022-03-27T17:43:05+00:00"
  },
  {
    "id": "691946126",
    "title": "Worldview Matters: Equipping Night 7 - Aaron Ferguson (3-23-2022)",
    "duration": 4612,
    "url": "https://player.vimeo.com/video/691946126",
    "date": "2022-03-24T18:03:34+00:00"
  },
  {
    "id": "690248642",
    "title": "The Psalms: Safety & Security - Psalm 48 (3-20-2022)",
    "duration": 2071,
    "url": "https://player.vimeo.com/video/690248642",
    "date": "2022-03-20T17:16:18+00:00"
  },
  {
    "id": "687681430",
    "title": "The Psalms: Praise the King over all Nations - Psalm 47 (3-13-2022)",
    "duration": 1999,
    "url": "https://player.vimeo.com/video/687681430",
    "date": "2022-03-13T17:20:32+00:00"
  },
  {
    "id": "686822656",
    "title": "Worldview Matters: Equipping Night 6 - Aaron Ferguson (3-9-2022)",
    "duration": 4254,
    "url": "https://player.vimeo.com/video/686822656",
    "date": "2022-03-10T18:46:58+00:00"
  },
  {
    "id": "685288429",
    "title": "Behold: The Self-Control of Jesus - Luke 4:1-13 (3-6-2022)",
    "duration": 2616,
    "url": "https://player.vimeo.com/video/685288429",
    "date": "2022-03-07T01:27:11+00:00"
  },
  {
    "id": "684371931",
    "title": "Worldview Matters: Equipping Night 5 - Aaron Ferguson (3-2-2022)",
    "duration": 4685,
    "url": "https://player.vimeo.com/video/684371931",
    "date": "2022-03-03T19:35:39+00:00"
  },
  {
    "id": "683844882",
    "title": "Child Abuse Prevention",
    "duration": 3629,
    "url": "https://player.vimeo.com/video/683844882",
    "date": "2022-03-02T15:33:40+00:00"
  },
  {
    "id": "682558291",
    "title": "Behold: The Kingship of Jesus - Luke 19:28-40 (2-27-2022)",
    "duration": 2393,
    "url": "https://player.vimeo.com/video/682558291",
    "date": "2022-02-27T18:45:32+00:00"
  },
  {
    "id": "679752846",
    "title": "Behold: The Faithfulness of Jesus - Luke 2:39-52 (2-20-2022)",
    "duration": 2353,
    "url": "https://player.vimeo.com/video/679752846",
    "date": "2022-02-20T18:34:37+00:00"
  },
  {
    "id": "678838304",
    "title": "Worldview Matters: Equipping Night 4 - Aaron Ferguson (2-16-2022)",
    "duration": 4606,
    "url": "https://player.vimeo.com/video/678838304",
    "date": "2022-02-17T18:50:26+00:00"
  },
  {
    "id": "676875121",
    "title": "Behold: The Goodness of Jesus - Luke 5:12-26 (2-13-2022)",
    "duration": 2315,
    "url": "https://player.vimeo.com/video/676875121",
    "date": "2022-02-13T19:34:59+00:00"
  },
  {
    "id": "676028146",
    "title": "Worldview Matters: Equipping Night 3 - Aaron Ferguson (2-9-2022)",
    "duration": 4557,
    "url": "https://player.vimeo.com/video/676028146",
    "date": "2022-02-10T19:51:21+00:00"
  },
  {
    "id": "676020663",
    "title": "Worldview Matters: Equipping Night 2 - Aaron Ferguson (1-26-2022)",
    "duration": 4512,
    "url": "https://player.vimeo.com/video/676020663",
    "date": "2022-02-10T19:29:20+00:00"
  },
  {
    "id": "676007405",
    "title": "Worldview Matters: Equipping Night 1 - Aaron Ferguson (1-19-2022)",
    "duration": 4195,
    "url": "https://player.vimeo.com/video/676007405",
    "date": "2022-02-10T18:52:39+00:00"
  },
  {
    "id": "674184823",
    "title": "Behold: The Kindness of Jesus - Luke 6:27-36 (2-6-2022)",
    "duration": 2345,
    "url": "https://player.vimeo.com/video/674184823",
    "date": "2022-02-06T18:52:16+00:00"
  },
  {
    "id": "671713988",
    "title": "Behold: The Patience of Jesus - Luke 13:1-9 (1-30-2022)",
    "duration": 2156,
    "url": "https://player.vimeo.com/video/671713988",
    "date": "2022-01-30T18:56:59+00:00"
  },
  {
    "id": "669197524",
    "title": "Behold: The Peace of Jesus - Luke 9:51-62 (1-23-2022)",
    "duration": 2494,
    "url": "https://player.vimeo.com/video/669197524",
    "date": "2022-01-23T20:39:01+00:00"
  },
  {
    "id": "666525974",
    "title": "Guest Speaker - Bill Liggett (1-16-2022)",
    "duration": 1942,
    "url": "https://player.vimeo.com/video/666525974",
    "date": "2022-01-16T18:35:49+00:00"
  },
  {
    "id": "665772145",
    "title": "Beyond the Talk: Protecting Your Children Online - Jason Kushmaul (1-12-2022)",
    "duration": 4386,
    "url": "https://player.vimeo.com/video/665772145",
    "date": "2022-01-13T20:16:54+00:00"
  },
  {
    "id": "665768221",
    "title": "Beyond the Talk: God's Design for Gender - Blair Holland (1-12-2022)",
    "duration": 1393,
    "url": "https://player.vimeo.com/video/665768221",
    "date": "2022-01-13T20:04:24+00:00"
  },
  {
    "id": "665762684",
    "title": "Beyond the Talk: As the World Turns - John Wohlgemuth (1-12-2022)",
    "duration": 4278,
    "url": "https://player.vimeo.com/video/665762684",
    "date": "2022-01-13T19:47:35+00:00"
  },
  {
    "id": "663988172",
    "title": "Behold: The Love of Jesus - Luke 19:1-10 (1-9-2022)",
    "duration": 2514,
    "url": "https://player.vimeo.com/video/663988172",
    "date": "2022-01-09T18:31:20+00:00"
  },
  {
    "id": "662020733",
    "title": "The Psalms: God Is Our Fortress - Psalm 46 (1-2-2022)",
    "duration": 2266,
    "url": "https://player.vimeo.com/video/662020733",
    "date": "2022-01-03T18:07:12+00:00"
  },
  {
    "id": "660533650",
    "title": "The Psalms: A Love Song - Psalm 45 (12-26-2021)",
    "duration": 1662,
    "url": "https://player.vimeo.com/video/660533650",
    "date": "2021-12-28T00:03:56+00:00"
  },
  {
    "id": "660530327",
    "title": "Christmas Eve Service (12-24-2021)",
    "duration": 3792,
    "url": "https://player.vimeo.com/video/660530327",
    "date": "2021-12-27T23:41:27+00:00"
  },
  {
    "id": "658380255",
    "title": "Love Jesus | Live Sent: Value 6: Intentional Disciple-Making - 2 Timothy 2:1-7 (12-19-2021)",
    "duration": 2604,
    "url": "https://player.vimeo.com/video/658380255",
    "date": "2021-12-19T19:51:55+00:00"
  },
  {
    "id": "655917674",
    "title": "The Christmas Story (12-8-2021)",
    "duration": 2804,
    "url": "https://player.vimeo.com/video/655917674",
    "date": "2021-12-12T21:05:01+00:00"
  },
  {
    "id": "655902905",
    "title": "Love Jesus | Live Sent: Value 5: Reimagined Generosity - Romans 12:1-8 (12-12-2021)",
    "duration": 2702,
    "url": "https://player.vimeo.com/video/655902905",
    "date": "2021-12-12T19:46:49+00:00"
  },
  {
    "id": "653470413",
    "title": "Deacon Ordination Service (12-1-2021)",
    "duration": 2883,
    "url": "https://player.vimeo.com/video/653470413",
    "date": "2021-12-05T20:25:46+00:00"
  },
  {
    "id": "653464370",
    "title": "Love Jesus | Live Sent: Value 4: Compelling Love - 1 John 4:7-21 (12-5-2021)",
    "duration": 2483,
    "url": "https://player.vimeo.com/video/653464370",
    "date": "2021-12-05T19:53:34+00:00"
  },
  {
    "id": "650879233",
    "title": "The Psalms: Cry Out to Him - Psalm 44 (11-28-2021)",
    "duration": 2302,
    "url": "https://player.vimeo.com/video/650879233",
    "date": "2021-11-28T19:29:47+00:00"
  },
  {
    "id": "648337928",
    "title": "Love Jesus | Live Sent: Value 3: Desperate Dependence - 2 Corinthians 12:1-10 (11-21-2021)",
    "duration": 3023,
    "url": "https://player.vimeo.com/video/648337928",
    "date": "2021-11-21T20:08:54+00:00"
  },
  {
    "id": "645800462",
    "title": "Love Jesus | Live Sent: Value 2: Life-Giving Hope - 1 Peter 1:3-9 (11-14-2021)",
    "duration": 2703,
    "url": "https://player.vimeo.com/video/645800462",
    "date": "2021-11-14T19:33:49+00:00"
  },
  {
    "id": "643270377",
    "title": "Love Jesus | Live Sent: Value 1: Anchoring Truth - 2 Timothy 3:10-17 (11-7-2021)",
    "duration": 2516,
    "url": "https://player.vimeo.com/video/643270377",
    "date": "2021-11-07T20:09:56+00:00"
  },
  {
    "id": "640925716",
    "title": "Love Jesus | Live Sent: Mission - Ephesians 4:11-16 (10-31-2021)",
    "duration": 2278,
    "url": "https://player.vimeo.com/video/640925716",
    "date": "2021-10-31T18:34:42+00:00"
  },
  {
    "id": "638869276",
    "title": "MOJ Restoring Hope (10-24-2021)",
    "duration": 3373,
    "url": "https://player.vimeo.com/video/638869276",
    "date": "2021-10-25T23:34:43+00:00"
  },
  {
    "id": "638779780",
    "title": "Love Jesus | Live Sent: Vision - Matthew 28:18-20 (10-24-2021)",
    "duration": 2442,
    "url": "https://player.vimeo.com/video/638779780",
    "date": "2021-10-25T18:31:09+00:00"
  },
  {
    "id": "634624880",
    "title": "The Psalms: Cry Out to God - Psalm 43 (10-17-2021)",
    "duration": 1868,
    "url": "https://player.vimeo.com/video/634624880",
    "date": "2021-10-17T17:53:24+00:00"
  },
  {
    "id": "628426049",
    "title": "Go Therefore, Part 3: The Lord Saves - Acts 27:1-28:31 (10-10-2021)",
    "duration": 2253,
    "url": "https://player.vimeo.com/video/628426049",
    "date": "2021-10-10T18:43:12+00:00"
  },
  {
    "id": "621738938",
    "title": "Go Therefore, Part 3: The Apostle Appeals - Acts 24:1-26:32 (10-3-2021)",
    "duration": 2519,
    "url": "https://player.vimeo.com/video/621738938",
    "date": "2021-10-03T18:36:07+00:00"
  },
  {
    "id": "615361830",
    "title": "Go Therefore, Part 3: The Apostle Testifies - Acts 21:18-23:35 (9-26-2021)",
    "duration": 2733,
    "url": "https://player.vimeo.com/video/615361830",
    "date": "2021-09-26T18:36:19+00:00"
  },
  {
    "id": "609186373",
    "title": "Go Therefore, Part 3: The Apostle Charges - Acts 20:2-21:17 (9-19-2021)",
    "duration": 2123,
    "url": "https://player.vimeo.com/video/609186373",
    "date": "2021-09-19T19:15:39+00:00"
  },
  {
    "id": "603474572",
    "title": "Go Therefore, Part 3: The Word Increases - Acts 18:23-20:1 (9-12-2021)",
    "duration": 2563,
    "url": "https://player.vimeo.com/video/603474572",
    "date": "2021-09-12T21:52:30+00:00"
  },
  {
    "id": "598988430",
    "title": "Go Therefore, Part 3: The Apostle Defends - Acts 17:16-18:22 (9-5-2021)",
    "duration": 2231,
    "url": "https://player.vimeo.com/video/598988430",
    "date": "2021-09-06T17:03:51+00:00"
  },
  {
    "id": "594241823",
    "title": "Go Therefore, Part 3: The Apostle Goes - Acts 15:35-17:15 (8-29-2021)",
    "duration": 2270,
    "url": "https://player.vimeo.com/video/594241823",
    "date": "2021-08-29T18:29:57+00:00"
  },
  {
    "id": "590676221",
    "title": "Go Therefore, Part 3: The Church Teaches - Acts 15:1-15:33 (8-22-2021)",
    "duration": 2612,
    "url": "https://player.vimeo.com/video/590676221",
    "date": "2021-08-22T19:09:41+00:00"
  },
  {
    "id": "587533048",
    "title": "Go Therefore, Part 3: The Church Sends - Acts 13:1-14:28 (8-15-2021)",
    "duration": 2537,
    "url": "https://player.vimeo.com/video/587533048",
    "date": "2021-08-15T18:45:24+00:00"
  },
  {
    "id": "584585812",
    "title": "The Psalms: Why Are You Cast Down, O My Soul? - Psalm 42 (8-8-2021)",
    "duration": 2012,
    "url": "https://player.vimeo.com/video/584585812",
    "date": "2021-08-08T17:48:12+00:00"
  },
  {
    "id": "581845070",
    "title": "The Psalms: Unshakable Confidence - Psalm 41 (8-1-2021)",
    "duration": 2189,
    "url": "https://player.vimeo.com/video/581845070",
    "date": "2021-08-01T18:31:25+00:00"
  },
  {
    "id": "579153483",
    "title": "The Psalms: Our Help and Our Deliverer - Psalm 40 (7-25-2021)",
    "duration": 2234,
    "url": "https://player.vimeo.com/video/579153483",
    "date": "2021-07-25T19:19:53+00:00"
  },
  {
    "id": "576479922",
    "title": "The Psalms: Life is a Vapor - Psalm 39 (7-18-2021)",
    "duration": 1867,
    "url": "https://player.vimeo.com/video/576479922",
    "date": "2021-07-18T18:31:33+00:00"
  },
  {
    "id": "573704675",
    "title": "The Psalms: The Declarations of Repentance - Psalm 38 (7-11-2021)",
    "duration": 2297,
    "url": "https://player.vimeo.com/video/573704675",
    "date": "2021-07-11T18:49:53+00:00"
  },
  {
    "id": "570974125",
    "title": "The Psalms: Blessed Are the Meek - Psalm 37 (7-4-2021)",
    "duration": 2058,
    "url": "https://player.vimeo.com/video/570974125",
    "date": "2021-07-04T19:05:40+00:00"
  },
  {
    "id": "568166431",
    "title": "The Psalms: God's Steadfast Love - Psalm 36 (6-27-2021)",
    "duration": 2409,
    "url": "https://player.vimeo.com/video/568166431",
    "date": "2021-06-27T19:16:32+00:00"
  },
  {
    "id": "565333915",
    "title": "The Psalms: Contend, O Lord - Psalm 35 (6-20-2021)",
    "duration": 2297,
    "url": "https://player.vimeo.com/video/565333915",
    "date": "2021-06-20T18:57:27+00:00"
  },
  {
    "id": "562535942",
    "title": "The Psalms: Taste and See - Psalm 34 (6-13-2021)",
    "duration": 2287,
    "url": "https://player.vimeo.com/video/562535942",
    "date": "2021-06-13T21:09:51+00:00"
  },
  {
    "id": "560068032",
    "title": "The Psalms: Worship and Trust - Psalm 33 (6-6-2021)",
    "duration": 1837,
    "url": "https://player.vimeo.com/video/560068032",
    "date": "2021-06-07T17:49:45+00:00"
  },
  {
    "id": "556927507",
    "title": "The Psalms: Blessed Confession - Psalm 32 (5-30-2021)",
    "duration": 2058,
    "url": "https://player.vimeo.com/video/556927507",
    "date": "2021-05-30T19:18:34+00:00"
  },
  {
    "id": "554013136",
    "title": "The Psalms: â€œIn Manus Tuasâ€ - Psalm 31 (5-23-2021)",
    "duration": 1870,
    "url": "https://player.vimeo.com/video/554013136",
    "date": "2021-05-23T19:06:23+00:00"
  },
  {
    "id": "550057060",
    "title": "Go Therefore, Part 2: The Lord Delivers - Acts 12:1-25 (5-16-2021)",
    "duration": 2075,
    "url": "https://player.vimeo.com/video/550057060",
    "date": "2021-05-16T18:40:07+00:00"
  },
  {
    "id": "549019047",
    "title": "Going Deeper: Acts 11:1-30 (5-12-2021)",
    "duration": 2657,
    "url": "https://player.vimeo.com/video/549019047",
    "date": "2021-05-13T20:18:16+00:00"
  },
  {
    "id": "547221408",
    "title": "Go Therefore, Part 2: The Church Changes - Acts 11:1-30 (5-9-2021)",
    "duration": 2300,
    "url": "https://player.vimeo.com/video/547221408",
    "date": "2021-05-09T19:06:46+00:00"
  },
  {
    "id": "547218167",
    "title": "Going Deeper: Acts 9:32â€“10:48 (5-5-2021)",
    "duration": 4254,
    "url": "https://player.vimeo.com/video/547218167",
    "date": "2021-05-09T18:52:15+00:00"
  },
  {
    "id": "544315946",
    "title": "Go Therefore, Part 2: The Mission Expands - Acts 9:32-10:48 (5-2-2021)",
    "duration": 2318,
    "url": "https://player.vimeo.com/video/544315946",
    "date": "2021-05-02T19:24:47+00:00"
  },
  {
    "id": "543211169",
    "title": "Going Deeper: Acts 9:1-31 (4-28-2021)",
    "duration": 3702,
    "url": "https://player.vimeo.com/video/543211169",
    "date": "2021-04-29T15:43:36+00:00"
  },
  {
    "id": "541357616",
    "title": "Go Therefore, Part 2: The Persecutor Believes - Acts 9:1-31 (4-25-2021)",
    "duration": 2202,
    "url": "https://player.vimeo.com/video/541357616",
    "date": "2021-04-25T18:58:11+00:00"
  },
  {
    "id": "540281442",
    "title": "Going Deeper: Acts 8:5-40 (4-21-2021)",
    "duration": 3628,
    "url": "https://player.vimeo.com/video/540281442",
    "date": "2021-04-22T17:54:31+00:00"
  },
  {
    "id": "538392382",
    "title": "Go Therefore, Part 2: The Gospel Spreads - Acts 8:5-40 (4-18-2021)",
    "duration": 2134,
    "url": "https://player.vimeo.com/video/538392382",
    "date": "2021-04-18T18:44:28+00:00"
  },
  {
    "id": "537326366",
    "title": "Going Deeper: Acts 8:1-4 (4-14-2021)",
    "duration": 4279,
    "url": "https://player.vimeo.com/video/537326366",
    "date": "2021-04-15T15:46:21+00:00"
  },
  {
    "id": "535589050",
    "title": "Go Therefore, Part 2: The Church Scatters - Acts 8:1-4 (4-11-2021)",
    "duration": 2295,
    "url": "https://player.vimeo.com/video/535589050",
    "date": "2021-04-11T19:17:03+00:00"
  },
  {
    "id": "534464469",
    "title": "Going Deeper: 1 Thessalonians 1 (4-7-2021)",
    "duration": 3260,
    "url": "https://player.vimeo.com/video/534464469",
    "date": "2021-04-08T14:24:15+00:00"
  },
  {
    "id": "533139686",
    "title": "Easter: Gospel Hope - 1 Thessalonians 1 (4-4-2021)",
    "duration": 1904,
    "url": "https://player.vimeo.com/video/533139686",
    "date": "2021-04-05T14:10:11+00:00"
  },
  {
    "id": "531890648",
    "title": "Wednesday Night - Bible in 60 (3-31-2021)",
    "duration": 4267,
    "url": "https://player.vimeo.com/video/531890648",
    "date": "2021-04-01T16:45:15+00:00"
  },
  {
    "id": "530033090",
    "title": "Palm Sunday: Great Expectations - Matthew 21:1-19 (3-28-2021)",
    "duration": 1751,
    "url": "https://player.vimeo.com/video/530033090",
    "date": "2021-03-28T18:13:22+00:00"
  },
  {
    "id": "526963360",
    "title": "The Psalms: Mourning into Dancing - Psalm 30 (3-21-2021)",
    "duration": 1822,
    "url": "https://player.vimeo.com/video/526963360",
    "date": "2021-03-21T18:19:06+00:00"
  },
  {
    "id": "523514507",
    "title": "The Psalms: The Glorious Lord - Psalm 29 (3-14-2021)",
    "duration": 2164,
    "url": "https://player.vimeo.com/video/523514507",
    "date": "2021-03-14T20:02:54+00:00"
  },
  {
    "id": "522160514",
    "title": "Going Deeper: Acts 6:8-7:60 (3-10-2021)",
    "duration": 3891,
    "url": "https://player.vimeo.com/video/522160514",
    "date": "2021-03-11T03:26:46+00:00"
  },
  {
    "id": "520688218",
    "title": "Go Therefore, Part 1: The Martyr Stands - Acts 6:8-7:60 (3-7-2021)",
    "duration": 2066,
    "url": "https://player.vimeo.com/video/520688218",
    "date": "2021-03-07T21:24:33+00:00"
  },
  {
    "id": "519696170",
    "title": "Going Deeper: The Beatitudes (3-3-2021)",
    "duration": 4050,
    "url": "https://player.vimeo.com/video/519696170",
    "date": "2021-03-04T21:41:58+00:00"
  },
  {
    "id": "518337280",
    "title": "Going Deeper: Acts 6:1-7 (2-24-2021)",
    "duration": 3517,
    "url": "https://player.vimeo.com/video/518337280",
    "date": "2021-03-01T22:16:37+00:00"
  },
  {
    "id": "517866984",
    "title": "The Good Life: Matthew 5:3 (2-28-2021)",
    "duration": 2158,
    "url": "https://player.vimeo.com/video/517866984",
    "date": "2021-02-28T20:19:41+00:00"
  },
  {
    "id": "516476137",
    "title": "Triumph IX Testimony - Lowell (2-22-2021)",
    "duration": 1491,
    "url": "https://player.vimeo.com/video/516476137",
    "date": "2021-02-25T00:40:35+00:00"
  },
  {
    "id": "515018476",
    "title": "Go Therefore, Part 1: The Church Matures - Acts 6:1-7 (2-21-2021)",
    "duration": 1950,
    "url": "https://player.vimeo.com/video/515018476",
    "date": "2021-02-21T20:21:34+00:00"
  },
  {
    "id": "512539338",
    "title": "Go Therefore, Part 1: The Church Flourishes - Acts 4:32-5:42 (2-14-2021)",
    "duration": 2038,
    "url": "https://player.vimeo.com/video/512539338",
    "date": "2021-02-15T14:34:43+00:00"
  },
  {
    "id": "509536968",
    "title": "Go Therefore: Boldness from the Sovereign Lord - Acts 4:5-31 (2-7-2021)",
    "duration": 2064,
    "url": "https://player.vimeo.com/video/509536968",
    "date": "2021-02-07T20:19:22+00:00"
  },
  {
    "id": "508253587",
    "title": "Going Deeper: Acts 3:1-4:4 (2-3-2021)",
    "duration": 4601,
    "url": "https://player.vimeo.com/video/508253587",
    "date": "2021-02-04T03:52:00+00:00"
  },
  {
    "id": "506830116",
    "title": "Go Therefore, Part 1: The Power Continues - Acts 3:1-4:4 (1-31-2021)",
    "duration": 2182,
    "url": "https://player.vimeo.com/video/506830116",
    "date": "2021-01-31T20:26:01+00:00"
  },
  {
    "id": "505501824",
    "title": "Going Deeper: Acts 2:42-47 (1-27-2021)",
    "duration": 4587,
    "url": "https://player.vimeo.com/video/505501824",
    "date": "2021-01-28T03:50:48+00:00"
  },
  {
    "id": "504149830",
    "title": "Go Therefore, Part 1: The Church Forms - Acts 2:42-47 (1-24-2021)",
    "duration": 2141,
    "url": "https://player.vimeo.com/video/504149830",
    "date": "2021-01-24T20:35:22+00:00"
  },
  {
    "id": "502926677",
    "title": "Going Deeper: Acts 1:12-2:41 (1-20-2021)",
    "duration": 4881,
    "url": "https://player.vimeo.com/video/502926677",
    "date": "2021-01-21T06:55:57+00:00"
  },
  {
    "id": "501513745",
    "title": "Go Therefore, Part 1: The Spirit Falls - Acts 1:12-2:41 (1-17-2021)",
    "duration": 2068,
    "url": "https://player.vimeo.com/video/501513745",
    "date": "2021-01-17T20:13:13+00:00"
  },
  {
    "id": "498953621",
    "title": "Go Therefore, Part 1: The Commission Comes - Acts 1:1-11 (1-10-2021)",
    "duration": 2169,
    "url": "https://player.vimeo.com/video/498953621",
    "date": "2021-01-10T18:29:59+00:00"
  },
  {
    "id": "495013231",
    "title": "Is 2020 Over Yet? - Romans 8:18-8:39 (12-27-2020)",
    "duration": 2226,
    "url": "https://player.vimeo.com/video/495013231",
    "date": "2020-12-27T18:42:05+00:00"
  },
  {
    "id": "493161566",
    "title": "Be The Light: The True Light Has Come - John 1:1-1:18 (12-20-2020)",
    "duration": 2174,
    "url": "https://player.vimeo.com/video/493161566",
    "date": "2020-12-21T00:05:36+00:00"
  },
  {
    "id": "490444864",
    "title": "Be the Light: Luke 1-2, Matthew 2, Isaiah 9 - On Them Has Light Shined (12-13-2020)",
    "duration": 2351,
    "url": "https://player.vimeo.com/video/490444864",
    "date": "2020-12-13T17:08:09+00:00"
  },
  {
    "id": "487884872",
    "title": "Be the Light: Genesis 1 - Let There Be Light (12-6-2020)",
    "duration": 1961,
    "url": "https://player.vimeo.com/video/487884872",
    "date": "2020-12-06T21:52:23+00:00"
  },
  {
    "id": "485162839",
    "title": "The Psalms: The Lord is our Shield - Psalm 28 (11-29-2020)",
    "duration": 1789,
    "url": "https://player.vimeo.com/video/485162839",
    "date": "2020-11-29T18:45:02+00:00"
  },
  {
    "id": "482380644",
    "title": "The Psalms: A Psalm of Fearless Trust - Psalm 27 (11-22-2020)",
    "duration": 2016,
    "url": "https://player.vimeo.com/video/482380644",
    "date": "2020-11-22T21:13:02+00:00"
  },
  {
    "id": "479565044",
    "title": "The Psalms: Psalm 67 (11-15-2020)",
    "duration": 1702,
    "url": "https://player.vimeo.com/video/479565044",
    "date": "2020-11-15T17:22:06+00:00"
  },
  {
    "id": "476920687",
    "title": "Jesus Is King - Revelation 1 (11-8-2020)",
    "duration": 2026,
    "url": "https://player.vimeo.com/video/476920687",
    "date": "2020-11-08T20:28:36+00:00"
  },
  {
    "id": "474472052",
    "title": "to be content...in all things - Philippians 4:10-23 (11-1-2020)",
    "duration": 2044,
    "url": "https://player.vimeo.com/video/474472052",
    "date": "2020-11-01T22:16:31+00:00"
  },
  {
    "id": "471975867",
    "title": "to be content...in our prayer - Philippians 4:1-9 (10-25-2020)",
    "duration": 2008,
    "url": "https://player.vimeo.com/video/471975867",
    "date": "2020-10-25T19:15:45+00:00"
  },
  {
    "id": "469545724",
    "title": "to be content...in one thing - Philippians 3:1-21 (10-18-2020)",
    "duration": 1757,
    "url": "https://player.vimeo.com/video/469545724",
    "date": "2020-10-18T19:52:33+00:00"
  },
  {
    "id": "466447993",
    "title": "to be content...in our example - Philippians 2:19-30 (10-11-2020)",
    "duration": 2131,
    "url": "https://player.vimeo.com/video/466447993",
    "date": "2020-10-09T05:40:12+00:00"
  },
  {
    "id": "464775645",
    "title": "to be content...in our purity - Philippians 2:12-18 (10-04-2020)",
    "duration": 2038,
    "url": "https://player.vimeo.com/video/464775645",
    "date": "2020-10-04T18:50:31+00:00"
  },
  {
    "id": "462404958",
    "title": "to be content...in our humility - Philippians 2:1-11 (9-27-2020)",
    "duration": 1814,
    "url": "https://player.vimeo.com/video/462404958",
    "date": "2020-09-27T18:53:23+00:00"
  },
  {
    "id": "459944242",
    "title": "to be content...in our suffering - Philippians 1:12-30 (9-20-2020)",
    "duration": 1957,
    "url": "https://player.vimeo.com/video/459944242",
    "date": "2020-09-20T18:48:32+00:00"
  },
  {
    "id": "457542014",
    "title": "to be content...in our fellowship - Philippians 1:1-11 (9-13-2020)",
    "duration": 2198,
    "url": "https://player.vimeo.com/video/457542014",
    "date": "2020-09-13T21:17:05+00:00"
  },
  {
    "id": "453083988",
    "title": "The Psalms: For His Name's Sake - Psalm 25 (8-30-2020)",
    "duration": 1846,
    "url": "https://player.vimeo.com/video/453083988",
    "date": "2020-08-30T19:03:15+00:00"
  },
  {
    "id": "450862714",
    "title": "The Psalms: The King of Glory - Psalm 24 (8-23-2020)",
    "duration": 1834,
    "url": "https://player.vimeo.com/video/450862714",
    "date": "2020-08-23T18:22:37+00:00"
  },
  {
    "id": "448331001",
    "title": "The Psalms: The Good Shepherd - Psalm 23 (8-16-2020)",
    "duration": 2034,
    "url": "https://player.vimeo.com/video/448331001",
    "date": "2020-08-16T18:44:04+00:00"
  },
  {
    "id": "446269571",
    "title": "The Psalms: Suffering Turned into Praise - Psalm 22 (8-9-2020)",
    "duration": 2088,
    "url": "https://player.vimeo.com/video/446269571",
    "date": "2020-08-09T18:40:03+00:00"
  },
  {
    "id": "446267914",
    "title": "HHBC Little Kids G2 - Large Group (8-12-2020)",
    "duration": 609,
    "url": "https://player.vimeo.com/video/446267914",
    "date": "2020-08-09T18:31:06+00:00"
  },
  {
    "id": "444039653",
    "title": "The Psalms: Rejoice in the Lord - Psalm 21 (8-2-2020)",
    "duration": 2036,
    "url": "https://player.vimeo.com/video/444039653",
    "date": "2020-08-02T18:28:25+00:00"
  },
  {
    "id": "441828195",
    "title": "The Psalms: Trust in the Lord - Psalm 20 (7-26-2020)",
    "duration": 1750,
    "url": "https://player.vimeo.com/video/441828195",
    "date": "2020-07-26T18:23:18+00:00"
  },
  {
    "id": "439768488",
    "title": "Better Together: Unity & Peace - Ephesians 4:1-3 (7-19-2020)",
    "duration": 1727,
    "url": "https://player.vimeo.com/video/439768488",
    "date": "2020-07-19T17:17:24+00:00"
  },
  {
    "id": "439733211",
    "title": "HHBC Big Kids G2 - Large Group (7-29-2020)",
    "duration": 619,
    "url": "https://player.vimeo.com/video/439733211",
    "date": "2020-07-19T14:11:21+00:00"
  },
  {
    "id": "437649650",
    "title": "Better Together: Patience - 1 Thessalonians 5:12-24 (7-12-2020)",
    "duration": 1955,
    "url": "https://player.vimeo.com/video/437649650",
    "date": "2020-07-12T18:33:27+00:00"
  },
  {
    "id": "435521722",
    "title": "Better Together: Gentleness - Titus 3:1-11 (7-5-2020)",
    "duration": 1935,
    "url": "https://player.vimeo.com/video/435521722",
    "date": "2020-07-05T18:01:41+00:00"
  },
  {
    "id": "435512009",
    "title": "HHBC Big Kids G2 - Large Group (7-8-2020)",
    "duration": 798,
    "url": "https://player.vimeo.com/video/435512009",
    "date": "2020-07-05T17:03:27+00:00"
  },
  {
    "id": "433378092",
    "title": "Better Together: Humility - James 4:1-12 (6-28-2020)",
    "duration": 1670,
    "url": "https://player.vimeo.com/video/433378092",
    "date": "2020-06-28T17:28:15+00:00"
  },
  {
    "id": "432856011",
    "title": "HHBC Little Kids G2 - Large Group (7-1-2020)",
    "duration": 734,
    "url": "https://player.vimeo.com/video/432856011",
    "date": "2020-06-26T13:51:27+00:00"
  },
  {
    "id": "432854135",
    "title": "HHBC Big Kids G2 - Large Group (7-1-2020)",
    "duration": 795,
    "url": "https://player.vimeo.com/video/432854135",
    "date": "2020-06-26T13:45:35+00:00"
  },
  {
    "id": "431239984",
    "title": "Better Together: The Goal (6-21-2020)",
    "duration": 2059,
    "url": "https://player.vimeo.com/video/431239984",
    "date": "2020-06-21T17:17:21+00:00"
  },
  {
    "id": "429131276",
    "title": "HHBC Little Kids G2 - Large Group (6-17-2020)",
    "duration": 617,
    "url": "https://player.vimeo.com/video/429131276",
    "date": "2020-06-15T02:48:19+00:00"
  },
  {
    "id": "429130452",
    "title": "HHBC Big Kids G2 - Large Group (6-17-2020)",
    "duration": 655,
    "url": "https://player.vimeo.com/video/429130452",
    "date": "2020-06-15T02:42:53+00:00"
  },
  {
    "id": "429028099",
    "title": "Better Together: The Example - John 4:1-42 (6-14-2020)",
    "duration": 2100,
    "url": "https://player.vimeo.com/video/429028099",
    "date": "2020-06-14T17:09:24+00:00"
  },
  {
    "id": "426784155",
    "title": "Better Together: The Command - Matthew 5:3-16 (6-7-2020)",
    "duration": 1611,
    "url": "https://player.vimeo.com/video/426784155",
    "date": "2020-06-07T18:48:46+00:00"
  },
  {
    "id": "424559850",
    "title": "The Psalms: God Is In Your Face - Psalm 19 (5-31-2020)",
    "duration": 3838,
    "url": "https://player.vimeo.com/video/424559850",
    "date": "2020-05-31T18:02:33+00:00"
  },
  {
    "id": "424559481",
    "title": "HHBC Little Kids G2 - Large Group (6-3-2020)",
    "duration": 623,
    "url": "https://player.vimeo.com/video/424559481",
    "date": "2020-05-31T18:00:42+00:00"
  },
  {
    "id": "422211961",
    "title": "Hour of Prayer (5-24-2020)",
    "duration": 4090,
    "url": "https://player.vimeo.com/video/422211961",
    "date": "2020-05-24T18:56:32+00:00"
  },
  {
    "id": "422173722",
    "title": "HHBC Little Kids G2 - Large Group (5-27-2020)",
    "duration": 663,
    "url": "https://player.vimeo.com/video/422173722",
    "date": "2020-05-24T16:00:49+00:00"
  },
  {
    "id": "419927670",
    "title": "Identity Applied: Work - Ephesians 6:5-9 (5-17-2020)",
    "duration": 3716,
    "url": "https://player.vimeo.com/video/419927670",
    "date": "2020-05-18T14:19:49+00:00"
  },
  {
    "id": "419639896",
    "title": "HHBC Little Kids G2 - Large Group (5-20-2020)",
    "duration": 613,
    "url": "https://player.vimeo.com/video/419639896",
    "date": "2020-05-17T17:33:59+00:00"
  },
  {
    "id": "417355619",
    "title": "Identity Applied: Parenting -  Ephesians 6:1-4 (5-10-2020)",
    "duration": 3987,
    "url": "https://player.vimeo.com/video/417355619",
    "date": "2020-05-11T20:47:20+00:00"
  },
  {
    "id": "417199668",
    "title": "HHBC Little Kids G2 - Large Group (5-13-2020)",
    "duration": 681,
    "url": "https://player.vimeo.com/video/417199668",
    "date": "2020-05-11T13:46:16+00:00"
  },
  {
    "id": "417197833",
    "title": "HHBC Big Kids G2 - Large Group (5-13-2020)",
    "duration": 709,
    "url": "https://player.vimeo.com/video/417197833",
    "date": "2020-05-11T13:41:07+00:00"
  },
  {
    "id": "414526187",
    "title": "Identity Applied: Marriage - Ephesians 5:22-33 (5-3-2020)",
    "duration": 3776,
    "url": "https://player.vimeo.com/video/414526187",
    "date": "2020-05-03T18:13:29+00:00"
  },
  {
    "id": "412312062",
    "title": "HHBC Little Kids G2 - Large Group (4-29-2020)",
    "duration": 689,
    "url": "https://player.vimeo.com/video/412312062",
    "date": "2020-04-27T13:27:24+00:00"
  },
  {
    "id": "412096582",
    "title": "Identity Applied: Spirit - Ephesians 5:15-21 (4-26-2020)",
    "duration": 3841,
    "url": "https://player.vimeo.com/video/412096582",
    "date": "2020-04-26T19:54:18+00:00"
  },
  {
    "id": "410763693",
    "title": "HHBC Wednesday Service - 1 Peter (4-15-2020)",
